09180000	"DOLORES RIVER NEAR CISCO, UT"	Active	Full	---	Yes	---	---	Yes
09180500	"COLORADO RIVER NEAR CISCO, UT"	Active	Full	---	Yes	---	---	Yes
09183500	"MILL CREEK AT SHELEY TUNNEL, NEAR MOAB, UT"	Active	Full	---	---	---	Yes	Yes
09188500	"GREEN RIVER AT WARREN BRIDGE, NEAR DANIEL, WY"	Active	None	---	Yes	---	---	Yes
09196500	"PINE CREEK ABOVE FREMONT LAKE, WY"	Active	Full	Yes	Yes	---	---	Yes
09205000	"NEW FORK RIVER NEAR BIG PINEY, WY"	Active	None	---	---	---	---	Yes
09209400	"GREEN RIVER NEAR LA BARGE, WY"	Active	None	---	---	---	---	Yes
09210500	"FONTENELLE C NR HERSCHLER RANCH, NR FONTENELLE, WY"	Active	Full	---	Yes	---	Yes	---
09211200	"GREEN RIVER BELOW FONTENELLE RESERVOIR, WY"	Active	None	---	Yes	---	---	Yes
09213500	"BIG SANDY RIVER NEAR FARSON, WY"	Active	None	---	---	---	---	Yes
09215000	"PACIFIC CREEK NEAR FARSON, WY"	Active	Full	---	---	---	Yes	---
09216527	SEPARATION C NR RINER WYO	Inactive	None	---	---	---	Yes	---
09217000	"GREEN RIVER NEAR GREEN RIVER, WY"	Active	Full	---	Yes	---	---	Yes
09217900	"BLACKS FORK NEAR ROBERTSON, WY"	Active	Full	---	---	---	---	Yes
09220000	"EAST FORK OF SMITHS FORK NEAR ROBERTSON, WY"	Active	Full	---	---	---	---	Yes
09220500	"WEST FORK OF SMITH FORK NEAR ROBERTSON, WY"	Inactive	None	---	---	---	Yes	---
09223000	"HAMS FORK BELOW POLE CREEK, NEAR FRONTIER, WY"	Active	Full	---	Yes	---	---	Yes
09224700	"BLACKS FORK NEAR LITTLE AMERICA, WY"	Active	None	---	Yes	---	---	Yes
09229500	"HENRYS FORK NEAR MANILA, UT"	Active	Full	---	---	---	---	Yes
09234500	"GREEN RIVER NEAR GREENDALE, UT"	Active	Full	---	Yes	Yes	---	---
09235490	"VERMILLION CR. BLW. DOUGLAS DRAW NR. LODORE, CO"	Inactive	None	---	---	---	Yes	---
09237450	"YAMPA RIVER ABOVE STAGECOACH RESERVOIR, CO"	Active	Partial	---	---	---	---	Yes
09239500	"YAMPA RIVER AT STEAMBOAT SPRINGS, CO"	Active	Full	---	---	---	---	Yes
09242500	"ELK RIVER NEAR MILNER, CO."	Active	Full	---	---	---	---	Yes
09245000	"ELKHEAD CREEK NEAR ELKHEAD, CO."	Inactive	None	---	---	---	---	Yes
09246400	"ELKHEAD CREEK BELOW MAYNARD GULCH, NEAR CRAIG, CO"	Inactive	None	---	---	---	---	Yes
09246920	"FORTIFICATION CREEK NEAR FORTIFICATION, CO"	Inactive	None	---	---	---	---	Yes
09247600	"YAMPA RIVER BELOW CRAIG, CO."	Active	Partial	---	---	---	---	Yes
09249500	"WILLIAMS FORK AT HAMILTON, CO."	Inactive	None	---	---	---	---	Yes
09251000	"YAMPA RIVER NEAR MAYBELL, CO"	Active	Full	---	Yes	---	---	Yes
09253000	"LITTLE SNAKE RIVER NEAR SLATER, CO"	Active	Full	---	Yes	---	---	Yes
09255000	"SLATER FORK NEAR SLATER, CO"	Active	Full	---	Yes	---	---	---
09255500	"SAVERY CREEK AT UPPER STATION, NEAR SAVERY, WY"	Inactive	None	---	---	---	Yes	---
09257000	"LITTLE SNAKE RIVER NEAR DIXON, WY"	Inactive	None	---	Yes	---	---	Yes
09260000	"LITTLE SNAKE RIVER NEAR LILY, CO"	Active	Full	---	Yes	---	---	Yes
09260050	"YAMPA RIVER AT DEERLODGE PARK, CO"	Active	None	---	---	Yes	---	Yes
09261000	"GREEN RIVER NEAR JENSEN, UT"	Active	Full	---	Yes	---	---	Yes
09261700	"BIG BRUSH CRK ABV RED FLEET RES, NR VERNAL, UT"	Active	None	---	---	---	---	Yes
09266500	"ASHLEY CREEK NEAR VERNAL, UT"	Active	None	---	---	---	---	Yes
09274900	"W.F. DUCHESNE RIV BEL VAT DIVERSION NR HANNA, UT"	Inactive	None	---	---	---	---	Yes
09275500	"WEST FORK DUCHESNE RIVER NEAR HANNA, UT"	Inactive	None	---	---	---	---	Yes
09277500	"DUCHESNE RIVER NEAR TABIONA, UT"	Active	Partial	---	---	---	---	Yes
09277800	"ROCK CREEK ABOVE SOUTH FORK, NEAR HANNA, UT"	Inactive	None	---	---	---	---	Yes
09279000	"ROCK CREEK NEAR MOUNTAIN HOME, UT"	Active	None	---	---	---	---	Yes
09279150	"DUCHESNE RIV ABV KNIGHT DIVERSION, NR DUCHESNE, UT"	Inactive	None	---	---	---	---	Yes
09285000	"STRAWBERRY RIVER NEAR SOLDIER SPRINGS, UT"	Inactive	None	---	---	---	---	Yes
09286700	"CURRANT CRK BLW CURRANT CRK DAM, NR FRUITLAND, UT"	Inactive	None	---	---	---	---	Yes
09288180	"STRAWBERRY RIVER NEAR DUCHESNE, UT"	Active	None	---	---	---	---	Yes
09289500	"LAKE FORK RIVER AB MOON LAKE, NR MOUNTAIN HOME, UT"	Active	Full	---	---	---	---	Yes
09292500	"YELLOWSTONE RIVER NEAR ALTONAH, UT"	Active	None	---	---	---	---	Yes
09295000	"DUCHESNE RIVER AT MYTON, UT"	Active	None	---	---	---	---	Yes
09296800	"UINTA R BLW POWERPLANT DIVERSION, NR NEOLA, UT"	Active	None	---	---	---	---	Yes
09299500	"WHITEROCKS RIVER NEAR WHITEROCKS, UT"	Active	Full	---	---	---	Yes	Yes
09302000	"DUCHESNE RIVER NEAR RANDLETT, UT"	Active	None	---	---	---	---	Yes
09303000	"NORTH FORK WHITE RIVER AT BUFORD, CO"	Active	None	---	---	---	Yes	---
09304500	"WHITE RIVER NEAR MEEKER, CO."	Active	Full	---	Yes	---	---	Yes
09304800	"WHITE RIVER BELOW MEEKER, CO"	Active	Partial	---	Yes	---	---	---
09306242	"CORRAL GULCH NEAR RANGELY, CO"	Active	Partial	---	---	---	Yes	---
09306500	"WHITE RIVER NEAR WATSON, UTAH"	Active	Full	---	Yes	Yes	---	Yes
09308000	"WILLOW CREEK NEAR OURAY, UTAH"	Inactive	None	---	---	---	Yes	---
09310000	"GOOSEBERRY CREEK NEAR SCOFIELD, UT"	Inactive	None	---	---	---	---	Yes
09311700	"PRICE RIVER NEAR SOLDIER SUMMIT, UTAH"	Inactive	None	---	---	---	---	Yes
09312600	"WHITE R BL TABBYUNE CRK NR SOLDIER SUMMIT, UT"	Active	None	---	---	---	---	Yes
09313000	"PRICE RIVER NEAR HEINER, UTAH"	Inactive	None	---	---	---	---	Yes
09314500	"PRICE RIVER AT WOODSIDE, UT"	Active	None	---	---	---	---	Yes
09315000	"GREEN RIVER AT GREEN RIVER, UT"	Active	Full	---	Yes	---	---	Yes
09317997	"HUNTINGTON CREEK NEAR HUNTINGTON, UT"	Inactive	None	---	---	---	---	Yes
09326500	"FERRON CREEK (UPPER STATION) NEAR FERRON, UT"	Active	None	---	---	---	---	Yes
09328500	"SAN RAFAEL RIVER NEAR GREEN RIVER, UT"	Active	Full	---	Yes	---	---	---
09329050	"SEVEN MILE CREEK NEAR FISH LAKE, UT"	Active	Full	---	---	---	---	Yes
09330500	"MUDDY CREEK NEAR EMERY, UT"	Active	Full	---	---	---	Yes	Yes
09333500	DIRTY DEVIL R AB POISON SP WSH NR HANKSVILLE UT	Active	Full	---	---	---	---	Yes
09339500	"ESCALANTE RIVER AT MOUTH NEAR ESCALANTE, UTAH"	Inactive	None	---	---	---	Yes	---
09342500	"SAN JUAN RIVER AT PAGOSA SPRINGS, CO"	Active	Full	---	Yes	---	---	Yes
09343300	"RIO BLANCO BEL BLANCO DIVN DAM, NR PAGOSA SPGS, CO"	Inactive	None	---	---	---	---	Yes
09344400	"NAVAJO RIVER BL OSO DIVERSION DAM NR CHROMO, CO."	Inactive	None	---	---	---	---	Yes
09346400	"SAN JUAN RIVER NEAR CARRACAS, CO."	Active	Full	---	Yes	---	---	Yes
09349800	"PIEDRA RIVER NEAR ARBOLES, CO."	Active	Full	---	Yes	---	---	Yes
09352900	"VALLECITO CREEK NEAR BAYFIELD, CO."	Active	Full	Yes	---	---	Yes	---
09353500	"LOS PINOS RIVER NEAR BAYFIELD, CO."	Inactive	None	---	---	---	---	Yes
09354500	"LOS PINOS RIVER AT LA BOCA, CO."	Active	Full	---	Yes	---	---	---
09361500	"ANIMAS RIVER AT DURANGO, CO"	Active	Partial	---	---	---	Yes	Yes
09362900	"FLORIDA RIVER BELOW LEMON RESERVOIR NR DURANGO, CO"	Inactive	None	---	---	---	---	Yes
09363500	"ANIMAS RIVER NEAR CEDAR HILL, NM"	Active	Partial	---	Yes	---	---	---
09364500	"ANIMAS RIVER AT FARMINGTON, NM"	Active	Partial	---	---	---	---	Yes
09365000	"SAN JUAN RIVER AT FARMINGTON, NM"	Active	Partial	---	---	---	---	Yes
09365500	"LA PLATA RIVER AT HESPERUS, CO"	Inactive	None	---	---	---	---	Yes
09366500	LA PLATA RIVER AT COLORADO-NEW MEXICO STATE LINE	Inactive	None	---	Yes	---	---	Yes
09368000	"SAN JUAN RIVER AT SHIPROCK, NM"	Active	Partial	---	---	---	---	Yes
09370000	"MANCOS RIVER NEAR MANCOS, CO."	Inactive	None	---	---	---	---	Yes
09371000	"MANCOS RIVER NEAR TOWAOC, CO."	Active	Partial	---	Yes	---	---	Yes
09371010	"SAN JUAN RIVER AT FOUR CORNERS, CO"	Active	None	---	Yes	Yes	---	---
09371492	"MUD CREEK AT STATE HIGHWAY 32, NEAR CORTEZ, CO."	Active	None	---	Yes	---	---	---
09371520	"MCELMO CREEK ABOVE TRAIL CANYON NEAR CORTEZ, CO"	Active	None	---	Yes	---	---	---
09372000	MCELMO CREEK NEAR COLORADO-UTAH STATE LINE	Active	Full	---	Yes	---	---	---
09378100	"NORTH CREEK ABV. RANGER STAT NR MONTICELLO, UTAH"	Inactive	None	---	---	---	---	Yes
09378170	"SOUTH CREEK ABOVE RESERVOIR NEAR MONTICELLO, UT"	Active	Full	---	---	---	---	Yes
09378650	"RECAPTURE CR BL JOHNSON CR NR BLANDING,UT."	Inactive	None	---	---	---	---	Yes
09378700	COTTONWOOD WASH NR BLANDING UTAH	Inactive	None	---	---	---	Yes	---
09379200	"CHINLE CREEK NEAR MEXICAN WATER, AZ"	Active	Full	---	Yes	---	---	---
09379500	"SAN JUAN RIVER NEAR BLUFF, UT"	Active	Full	---	Yes	Yes	---	Yes
09380000	"COLORADO RIVER AT LEES FERRY, AZ"	Active	Full	---	Yes	Yes	---	---
09382000	"PARIA RIVER AT LEES FERRY, AZ"	Active	Full	---	Yes	---	---	---
09383400	"LITTLE COLORADO RIVER AT GREER, AZ"	Active	Full	---	---	---	---	Yes
09384000	"LITTLE COLORADO R ABV LYMAN LAKE NR ST. JOHNS, AZ"	Active	None	---	---	---	---	Yes
09386020	"Carrizo Wash nr St. Johns, Az."	Inactive	None	---	Yes	---	---	---
09386900	"RIO NUTRIA NEAR RAMAH, NM"	Active	None	---	---	---	Yes	Yes
09386950	"ZUNI RIVER ABV BLACK ROCK RESERVOIR, NM"	Active	None	---	---	---	---	Yes
09394500	"LITTLE COLORADO RIVER AT WOODRUFF, AZ"	Active	Full	---	---	---	---	Yes
09395500	"PUERCO RIVER AT GALLUP, NM"	Inactive	None	---	---	---	Yes	---
09395650	"PUERCO RIVER, NEAR LUPTON, AZ"	Inactive	None	---	Yes	---	---	---
09397500	"CHEVELON FORK BELOW WILDCAT CANYON, NR WINSLOW, AZ"	Active	None	---	---	---	---	Yes
09398500	"CLEAR CREEK BELOW WILLOW CREEK, N WINSLOW, AZ."	Inactive	None	---	---	---	---	Yes
09402000	"LITTLE COLORADO RIVER NEAR CAMERON, AZ"	Active	None	---	---	Yes	---	---
09402500	"COLORADO RIVER NEAR GRAND CANYON, AZ"	Active	None	---	Yes	---	---	---
09404104	"CATARACT CREEK AT REDLANDS CROSSING NEAR VALLE, AZ"	Active	Partial	---	---	---	Yes	---
09404343	"TRUXTON WASH NEAR VALENTINE, AZ"	Active	Partial	---	---	---	Yes	---
09404450	"EAST FORK VIRGIN RIVER NEAR GLENDALE, UT"	Active	Full	---	---	---	Yes	---
09406000	"VIRGIN RIVER AT VIRGIN, UT"	Active	Full	---	---	---	---	Yes
09408150	"VIRGIN RIVER NEAR HURRICANE, UT"	Active	Full	---	---	---	---	Yes
09408195	"FORT PEARCE WASH NEAR ST. GEORGE, UT"	Active	Full	---	Yes	---	---	Yes
09408400	"SANTA CLARA RIVER NEAR PINE VALLEY, UT"	Active	None	---	---	---	---	Yes
09409100	"SANTA CLARA RIVER ABV BAKER RES, NR CENTRAL, UT"	Active	None	---	---	---	Yes	---
09413500	"VIRGIN RIVER NEAR ST. GEORGE, UT"	Active	Full	---	Yes	---	---	---
09414900	"BEAVER DAM WASH AT BEAVER DAM, AZ"	Inactive	None	---	Yes	---	---	---
09415000	"VIRGIN RV AT LITTLEFIELD, AZ"	Active	None	---	Yes	---	---	Yes
09417500	"MEADOW VALLEY WASH AT EAGLE CYN NR URSINE, NV"	Active	Full	---	---	---	---	Yes
09418500	"MEADOW VALLEY WASH NR CALIENTE, NV"	Active	Full	---	---	---	Yes	---
09419000	"MUDDY RV NR GLENDALE, NV"	Active	None	---	---	---	---	Yes
09419610	"LEE CYN NR CHARLESTON PARK, NV"	Inactive	None	---	---	---	Yes	---
094196783	"LV WASH BLW FLAMINGO WASH CONFL NR LAS VEGAS, NV"	Active	None	Yes	---	---	---	---
09419753	"LV WASH ABV THREE KIDS WASH BLW HENDERSON, NV"	Active	None	---	---	---	---	Yes
09421500	"COLORADO RV BLW HOOVER DAM, AZ-NV"	Active	None	---	---	Yes	---	Yes
09423000	"COLORADO RIVER BELOW DAVIS DAM, AZ-NV"	Active	Full	---	Yes	---	---	---
09423550	"TOPOCK MARSH INLET NEAR NEEDLES, CA"	Inactive	Full	---	Yes	---	---	---
09423650	"TOPOCK MARSH OUTLET NEAR TOPOCK, AZ"	Inactive	Partial	---	Yes	---	---	---
09424150	"COLORADO RIVER AQUEDUCT NEAR PARKER DAM, AZ-CA"	Active	Partial	---	Yes	---	---	---
09424200	"COTTONWOOD WASH NO. 1 NEAR KINGMAN, AZ."	Inactive	None	---	---	---	Yes	---
09424450	"BIG SANDY RIVER NEAR WIKIEUP, AZ"	Active	None	---	---	---	Yes	---
09426620	"BILL WILLIAMS RIVER NEAR PARKER, AZ"	Active	Partial	---	---	Yes	---	---
09426650	CENTRAL ARIZONA PROJECT CANAL AT HAVASU PUMPING PL	Active	Partial	---	Yes	---	---	---
09427520	"COLORADO RIVER BELOW PARKER DAM, AZ-CA"	Active	Full	---	Yes	---	---	---
09428500	"CRIR MAIN CANAL NEAR PARKER, AZ"	Active	Partial	---	Yes	---	---	---
09428505	"GARDNER LATERAL SPILL NEAR PARKER, AZ"	Active	Full	---	Yes	---	---	---
09428510	"POSTON WASTEWAY NEAR POSTON, AZ"	Active	Full	---	Yes	---	---	---
09429000	"PALO VERDE CANAL NEAR BLYTHE, CA"	Active	Partial	---	Yes	---	---	---
09429030	"PALO VERDE DRAIN NEAR PARKER, AZ"	Active	Partial	---	Yes	---	---	---
09429060	"CRIR LOWER MAIN DRAIN NEAR PARKER, AZ"	Inactive	Full	---	Yes	---	---	---
09429100	"COLORADO RIVER BELOW PALO VERDE DAM, AZ-CA"	Active	Full	---	Yes	---	---	---
09429130	"P.V.I.D. OLIVE LAKE DRAIN NEAR BLYTHE, CA"	Active	Partial	---	Yes	---	---	---
09429155	"PVID F-CANAL SPILL NEAR BLYTHE, CA"	Active	Partial	---	Yes	---	---	---
09429160	"PVID D-10-11-2 SPILL NR BLYTHE, CA"	Active	Partial	---	Yes	---	---	---
09429170	"PVID D-10-11-5 SPILL NR BLYTHE, CA"	Active	Partial	---	Yes	---	---	---
09429180	"PVID D23 SPILL NEAR BLYTHE, CA"	Active	Partial	---	Yes	---	---	---
09429190	"P.V.I.D. D-23-1 NEAR BLYTHE, CA"	Active	Partial	---	Yes	---	---	---
09429200	"PVID C CANAL SPILL NEAR BLYTHE, CA"	Active	Partial	---	Yes	---	---	---
09429210	"P.V.I.D. C-28 UPPER SPILL NEAR BLYTHE, CA"	Active	Partial	---	Yes	---	---	---
09429220	"PALO VERDE OUTFALL DRAIN NEAR PALO VERDE, CA"	Active	Partial	---	Yes	---	---	---
09429230	"PVID C28 LOWER SPILL NEAR BLYTHE, CA."	Active	Partial	---	Yes	---	---	---
09429500	"COLORADO RIVER BELOW IMPERIAL DAM, AZ-CA"	Active	Full	---	Yes	---	---	---
09429600	"COLORADO RIVER BELOW LAGUNA DAM, AZ-CA"	Active	Full	---	Yes	---	---	---
09430500	"GILA RIVER NEAR GILA, NM"	Active	Partial	---	---	---	---	Yes
09430600	"MOGOLLON CREEK NEAR CLIFF, NM"	Active	Partial	Yes	---	---	Yes	---
09431500	"GILA RIVER NEAR REDROCK, NM"	Active	Partial	---	---	---	---	Yes
09432000	"GILA RIVER BELOW BLUE CREEK, NEAR VIRDEN, NM"	Active	None	---	Yes	---	---	Yes
09439000	"GILA RIVER AT DUNCAN, AZ"	Active	Full	---	---	---	---	Yes
09442000	"GILA RIVER NEAR CLIFTON, AZ"	Active	Full	---	---	---	---	Yes
09444000	"SAN FRANCISCO RIVER NEAR GLENWOOD, NM"	Active	Partial	---	Yes	---	---	Yes
09444200	"BLUE RIVER NEAR CLIFTON, AZ."	Active	None	---	---	---	---	Yes
09444500	"SAN FRANCISCO RIVER AT CLIFTON, AZ."	Active	None	---	---	---	---	Yes
09447000	"EAGLE CREEK ABOVE PUMPING PLANT, NEAR MORENCI, AZ."	Active	None	---	---	---	---	Yes
09447800	"BONITA CREEK NEAR MORENCI, AZ."	Active	Full	---	---	---	Yes	---
09448500	"GILA RIVER AT HEAD OF SAFFORD VALLEY, NR SOLOMON,"	Active	None	---	---	---	---	Yes
09451000	GILA R NR SOLOMON ARIZ	Inactive	None	---	---	---	---	Yes
09454000	San Simon R Nr Rodeo Nm	Inactive	None	---	Yes	---	---	---
09469500	"GILA RIVER BELOW COOLIDGE DAM, AZ."	Active	None	---	---	Yes	---	Yes
09470000	"GILA RIVER AT WINKELMAN, ARIZ."	Inactive	None	---	---	Yes	---	---
09470500	"SAN PEDRO RIVER AT PALOMINAS, AZ."	Active	Partial	---	Yes	---	---	---
09471000	"SAN PEDRO RIVER AT CHARLESTON, AZ."	Active	None	Yes	---	---	---	Yes
09471400	"BABOCOMARI RIVER NEAR TOMBSTONE, AZ."	Active	None	---	---	---	---	Yes
09473000	"ARAVAIPA CREEK NEAR MAMMOTH, AZ."	Active	None	---	---	---	Yes	---
09479200	QUEEN C TRIB A APACHE JUNC ARIZ	Inactive	None	---	---	---	Yes	---
09479500	"GILA RIVER NEAR LAVEEN, ARIZ."	Inactive	None	---	---	Yes	---	---
09480500	"SANTA CRUZ RIVER NEAR NOGALES, AZ."	Active	Full	---	Yes	---	---	---
09481740	"SANTA CRUZ RIVER AT TUBAC, AZ."	Active	Full	Yes	---	---	Yes	---
09488500	"SANTA ROSA WASH NR. VAIVA VO, ARIZ."	Inactive	None	---	---	---	Yes	---
09489000	"SANTA CRUZ RIVER NEAR LAVEEN, AZ."	Active	Partial	---	---	Yes	---	---
09489500	"BLACK RVR BLW PUMPING PLANT, NR POINT OF PINES, AZ"	Active	None	---	---	---	---	Yes
09489700	"BIG BONITO C NR FORT APACHE, ARIZ."	Inactive	None	---	---	---	---	Yes
09490500	"BLACK RIVER NEAR FORT APACHE, AZ."	Active	None	---	---	---	---	Yes
09494000	"WHITE RIVER NEAR FORT APACHE, AZ."	Active	Full	---	---	---	---	Yes
09496500	"CARRIZO CREEK NEAR SHOW LOW, AZ."	Active	None	---	---	---	---	Yes
09497500	"SALT RIVER NEAR CHRYSOTILE, AZ"	Active	None	---	---	---	---	Yes
09497800	"CIBECUE CREEK NEAR CHRYSOTILE, AZ"	Active	Full	---	---	---	Yes	Yes
09497980	"CHERRY CREEK NEAR GLOBE, AZ"	Active	Partial	---	---	---	---	Yes
09498500	"SALT RIVER NEAR ROOSEVELT, AZ"	Active	None	---	---	---	---	Yes
09498503	"SOUTH FORK PARKER CREEK NEAR ROOSEVELT, AZ"	Active	Full	---	Yes	---	---	---
09499000	"TONTO CREEK ABOVE GUN CREEK, NEAR ROOSEVELT, AZ"	Active	None	---	---	---	---	Yes
09504000	"VERDE RIVER NEAR CLARKDALE, AZ"	Active	Partial	---	---	---	---	Yes
09504500	"OAK CREEK NEAR CORNVILLE, AZ"	Active	Partial	---	---	---	---	Yes
09505200	"WET BEAVER CREEK NEAR RIMROCK, AZ"	Active	Partial	---	---	---	---	Yes
09505350	"DRY BEAVER CREEK NEAR RIMROCK, AZ"	Active	Partial	---	---	---	---	Yes
09505800	"WEST CLEAR CREEK NEAR CAMP VERDE, AZ"	Active	Partial	Yes	---	---	---	Yes
09507980	"EAST VERDE RIVER NEAR CHILDS, AZ"	Active	None	---	---	---	Yes	Yes
09508300	"WET BOTTOM CREEK NEAR CHILDS, AZ"	Active	Full	Yes	---	---	---	---
09508500	"VERDE RVR BLW TANGLE CREEK, ABV HORSESHOE DAM, AZ"	Active	None	---	---	---	---	Yes
09511300	"VERDE RIVER NEAR SCOTTSDALE, AZ"	Active	None	---	---	Yes	---	---
09512165	"SALT RIVER AT PRIEST DRIVE NEAR PHOENIX, AZ."	Active	Partial	---	---	Yes	---	---
09512280	"CAVE CREEK BLW COTTONWOOD CR NEAR CAVE CREEK, AZ."	Active	Partial	---	---	---	Yes	---
09512500	"AGUA FRIA RIVER NEAR MAYER, AZ"	Active	None	---	---	---	Yes	---
09512800	"AGUA FRIA RIVER NEAR ROCK SPRINGS, AZ"	Active	None	---	---	---	---	Yes
09517000	"HASSAYAMPA RIVER NEAR ARLINGTON, AZ"	Active	None	Yes	---	---	---	---
09517490	CENTENNIAL WASH AT SOUTHERN PACIFIC RAILROAD BRDG	Active	Partial	---	---	---	Yes	---
09519800	"GILA RIVER BELOW PAINTED ROCK DAM, AZ"	Active	None	---	---	Yes	---	Yes
09520170	"RIO CORNEZ NR AJO, AZ"	Inactive	None	---	---	---	Yes	---
09520500	"GILA RIVER NEAR DOME, AZ"	Active	Partial	---	---	Yes	---	---
09521100	"COLORADO R BLW YUMA MAIN CANAL WW AT YUMA, AZ"	Active	None	---	Yes	---	---	---
09522000	"COLORADO RIVER AT NIB, ABOVE MORELOS DAM, AZ"	Active	Partial	Yes	---	Yes	---	---
09522400	"MITTRY LAKE DIVERSION AT IMPERIAL DAM, AZ"	Active	Partial	---	Yes	---	---	---
09522500	"GILA GRAVITY MAIN CANAL AT IMPERIAL DAM, AZ-CA"	Active	Full	---	Yes	---	---	---
09522600	"NORTH GILA MAIN CANAL NEAR YUMA, AZ"	Active	Partial	---	Yes	---	---	---
09522650	"NORTH GILA MAIN CANAL NO. 2 NEAR YUMA, AZ"	Active	Partial	---	Yes	---	---	---
09522700	"WELLTON-MOHAWK MAIN CANAL NEAR YUMA, AZ"	Active	Full	---	Yes	---	---	---
09522800	"SOUTH GILA MAIN CANAL NEAR YUMA, AZ"	Active	Partial	---	Yes	---	---	---
09523000	"ALL-AMERICAN CANAL NR IMPERIAL DAM, CA-AZ"	Active	Partial	---	Yes	---	---	---
09523200	"RESERVATION MAIN CANAL NEAR YUMA, AZ"	Active	Partial	---	Yes	---	---	---
09523400	"TITSINK CANAL NEAR YUMA, AZ"	Active	Partial	---	Yes	---	---	---
09523600	"YAQUI CANAL NEAR YUMA, AZ"	Active	Partial	---	Yes	---	---	---
09523800	"PONTIAC CANAL NEAR YUMA, AZ"	Active	Partial	---	Yes	---	---	---
09524000	"YUMA MAIN CANAL AT SIPHON DROP P.P. NR YUMA, AZ"	Active	Partial	---	Yes	---	---	---
09524500	DIV. FROM YUMA MAIN CANAL BETWEEN SDPP AND YMCWW	Inactive	Partial	---	Yes	---	---	---
09525000	"YUMA MAIN CANAL WASTEWAY AT YUMA, AZ"	Active	Partial	---	Yes	---	---	---
09525500	"YUMA MAIN CANAL BLW COLORADO R. SIPHON AT YUMA, AZ"	Active	Full	---	Yes	---	---	---
09526200	"YPSILANTI CANAL NEAR WINTERHAVEN, CA"	Active	Full	---	Yes	---	---	---
09527000	"PILOT KNOB POWERPLANT AND WASTEWAY NR P.K., CA"	Active	Partial	---	Yes	---	---	---
09527500	"ALL-AMERICAN CANAL BLW PILOT KNOB WASTEWAY, CA"	Active	Partial	---	Yes	---	---	---
09528800	"LEVEE CANAL WASTEWAY NEAR YUMA, AZ"	Active	Partial	---	Yes	---	---	---
09529000	"GILA DRAIN NO. 1 NEAR YUMA, AZ"	Active	Partial	---	Yes	---	---	---
09529150	"NORTH GILA MAIN CANAL WASTEWAY NEAR YUMA, AZ"	Active	Partial	---	Yes	---	---	---
09529160	"SOUTH GILA PUMP OUTLET CHANNEL NO 3 NEAR YUMA, AZ"	Inactive	Partial	---	Yes	---	---	---
09529240	"SOUTH GILA PUMP OUTLET CHANNEL NO 2 NEAR YUMA, AZ"	Inactive	Partial	---	Yes	---	---	---
09529250	"BRUCE CHURCH WASTEWAY NEAR YUMA, AZ"	Active	Partial	---	Yes	---	---	---
09529360	"SOUTH GILA PUMP OUTLET CHANNEL NO 1 NEAR YUMA, AZ"	Inactive	None	---	Yes	---	---	---
09529420	"SOUTH GILA TERMINAL CANAL WASTEWAY NR YUMA, AZ"	Active	Partial	---	Yes	---	---	---
09529440	"SOUTH GILA PUMP OUTLET CHANNEL NO 4 NEAR YUMA, AZ"	Inactive	Partial	---	Yes	---	---	---
09530000	"RESERVATION MAIN DRAIN NO. 4 NEAR YUMA, AZ"	Active	Partial	---	Yes	---	---	---
09530200	"YUMA MESA OUTLET DRAIN NEAR YUMA, AZ"	Inactive	Partial	---	Yes	---	---	---
09530500	"DRAIN 8-B NEAR WINTERHAVEN, CA"	Active	Partial	---	Yes	---	---	---
09535300	"VAMORI WASH AT KOM VO, AZ"	Active	Full	---	---	Yes	Yes	---
09537200	"LESLIE CREEK NEAR MCNEAL, AZ."	Active	Partial	---	---	---	Yes	---
09537500	"WHITEWATER DRAW NEAR DOUGLAS, AZ."	Active	Full	---	Yes	Yes	---	---
10011500	BEAR RIVER NEAR UTAH-WYOMING STATE LINE	Active	Full	---	Yes	---	Yes	Yes
10016900	"BEAR RIVER AT EVANSTON, WY"	Active	None	---	Yes	---	---	---
10020100	"BEAR RIVER ABOVE RESERVOIR, NEAR WOODRUFF, UT"	Active	Full	---	Yes	---	---	Yes
10020300	"BEAR RIVER BELOW RESERVOIR, NEAR WOODRUFF, UT"	Active	None	---	Yes	---	---	---
10023000	"BIG CREEK NEAR RANDOLPH, UT"	Active	None	---	---	---	---	Yes
10026500	"BEAR RIVER NEAR RANDOLPH, UT"	Inactive	None	---	Yes	---	---	Yes
10027000	"TWIN CREEK AT SAGE, WY"	Inactive	None	---	Yes	---	Yes	---
10028500	"BEAR RIVER BELOW PIXLEY DAM, NEAR COKEVILLE, WY"	Active	None	---	Yes	---	---	---
10032000	"SMITHS FORK NEAR BORDER, WY"	Active	None	---	Yes	---	---	Yes
10038000	"BEAR RIVER BELOW SMITHS FORK, NR COKEVILLE, WY"	Active	Full	---	Yes	---	---	---
10039500	"BEAR RIVER AT BORDER, WY"	Active	None	---	Yes	---	---	Yes
10041000	THOMAS FORK NEAR WYOMING-IDAHO STATE LINE	Inactive	None	---	---	---	Yes	Yes
10044000	"BEAR RIVER AT HARER, ID"	Inactive	None	---	---	Yes	---	Yes
10047000	"MONTPELIER CREEK NEAR MONTPELIER, ID"	Inactive	None	---	---	---	---	Yes
10047500	"MONTPELIER CR AT IRRIG. WEIR, NR MONTPELIER, ID"	Inactive	None	---	---	---	---	Yes
10058600	"BLOOMINGTON CREEK AT BLOOMINGTON, ID"	Inactive	None	---	---	---	Yes	---
10068500	BEAR RIVER AT PESCADERO ID	Active	None	---	Yes	---	---	---
10092700	BEAR RIVER AT IDAHO-UTAH STATE LINE	Active	None	---	Yes	---	---	---
10093000	CUB RIVER NR PRESTON ID	Inactive	None	---	---	---	---	Yes
10102200	CUB R NR RICHMOND UTAH	Inactive	None	---	---	---	Yes	Yes
10105900	"LITTLE BEAR RIVER AT PARADISE, UT"	Active	None	---	---	---	---	Yes
10109000	"LOGAN RIVER ABOVE STATE DAM, NEAR LOGAN, UT"	Active	Full	---	Yes	---	---	Yes
10109001	COM F LOGAN R AB ST D AND CACHE HL CAN NR LOGAN UT	Active	None	---	---	---	---	Yes
10113500	"BLACKSMITH FORK AB UP and L CO.S DAM NR HYRUM, UT"	Active	Full	---	---	---	Yes	Yes
10126000	"BEAR RIVER NEAR CORINNE, UT"	Active	None	---	Yes	Yes	---	---
10128000	"SMITH AND MOREHOUSE CREEK NEAR OAKLEY, UTAH"	Inactive	None	---	---	---	---	Yes
10128500	"WEBER RIVER NEAR OAKLEY, UT"	Active	Full	---	---	---	Yes	Yes
10129500	"WEBER RIVER NEAR WANSHIP, UT"	Active	None	---	---	---	---	Yes
10130500	"WEBER RIVER NEAR COALVILLE, UT"	Active	None	---	---	---	---	Yes
10131000	"CHALK CREEK AT COALVILLE, UT"	Active	None	---	---	---	---	Yes
10132000	"WEBER RIVER AT ECHO, UT"	Active	None	---	---	---	---	Yes
10132500	"LOST CREEK NEAR CROYDON, UTAH"	Active	None	---	---	---	---	Yes
10134500	"EAST CANYON CREEK NEAR MORGAN, UT"	Active	None	---	---	---	---	Yes
10136500	"WEBER RIVER AT GATEWAY, UT"	Active	None	---	---	---	---	Yes
10137500	"SOUTH FORK OGDEN RIVER NEAR HUNTSVILLE, UT"	Active	None	---	---	---	---	Yes
10139300	"WHEELER CREEK NEAR HUNTSVILLE, UTAH"	Inactive	None	---	---	---	---	Yes
10140100	"OGDEN RIVER BL PINEVIEW RES NR HUNTSVILLE, UT"	Active	None	---	---	---	---	Yes
10141000	"WEBER RIVER NEAR PLAIN CITY, UT"	Active	None	---	---	Yes	---	---
10147500	"PAYSON CREEK ABV DIVERSIONS, NEAR PAYSON, UTAH"	Inactive	None	---	---	---	---	Yes
10148500	"SPANISH FORK AT THISTLE, UTAH"	Inactive	None	---	---	---	---	Yes
10150500	"SPANISH FORK AT CASTILLA, UT"	Active	None	---	---	---	---	Yes
10152500	HOBBLE CR NR SPRINGVILLE UTAH	Inactive	None	---	---	---	---	Yes
10154200	"PROVO RIVER NEAR WOODLAND, UT"	Active	None	---	---	---	---	Yes
10155000	"PROVO RIVER NEAR HAILSTONE, UT"	Active	None	---	---	---	---	Yes
10155500	"PROVO RIVER NEAR CHARLESTON, UT"	Active	None	---	---	---	---	Yes
10159500	"PROVO RIVER BELOW DEER CREEK DAM, UT"	Inactive	None	---	---	---	---	Yes
10164500	"AMERICAN FK AB UPPER POWERPLANT NR AMERICAN FK, UT"	Active	Full	---	---	---	---	Yes
10166430	"WEST CANYON CREEK NEAR CEDAR FORT, UT"	Active	Full	---	---	---	Yes	Yes
10167000	"JORDAN RIVER AT NARROWS NEAR LEHI, UTAH"	Inactive	None	---	---	---	---	Yes
10167500	"LITTLE COTTONWOOD CREEK NR SALT LAKE CITY, UT"	Inactive	None	---	---	---	---	Yes
10168000	LITTLE COTTONWOOD CREEK @ JORDAN RIVER NR SLC	Active	Full	Yes	---	---	---	Yes
10168500	BIG COTTONWOOD CR NR SALT LAKE CITY UTAH	Inactive	None	---	---	---	---	Yes
10170000	"MILL CREEK NEAR SALT LAKE CITY, UTAH"	Inactive	None	---	---	---	---	Yes
10171000	"JORDAN RIVER @ 1700 SOUTH @ SALT LAKE CITY, UT"	Active	None	Yes	---	Yes	---	---
10171500	"PARLEYS CREEK NEAR SALT LAKE CITY, UTAH"	Inactive	None	---	---	---	---	Yes
10172000	"EMIGRATION CREEK NEAR SALT LAKE CITY, UTAH"	Inactive	None	---	---	---	---	Yes
10172200	"RED BUTTE CREEK AT FORT DOUGLAS, NEAR SLC, UT"	Active	Full	Yes	---	---	Yes	---
10172400	"CITY CREEK ABV WASATCH DRIVE NR SALT LAKE CITY, UT"	Inactive	None	---	---	---	---	Yes
10172500	"CITY CREEK NEAR SALT LAKE CITY, UTAH"	Inactive	None	---	---	---	---	Yes
10172700	"VERNON CREEK NEAR VERNON, UT"	Active	Full	---	---	---	Yes	Yes
10172791	"SETTLEMENT CREEK ABOVE RESERVOIR NEAR TOOELE, UT"	Inactive	None	---	---	---	---	Yes
10172800	"SOUTH WILLOW CREEK NEAR GRANTSVILLE, UT"	Active	None	---	---	---	---	Yes
10172870	"TROUT CREEK NEAR CALLAO, UT"	Active	Full	---	---	---	---	Yes
10172952	"DUNN CREEK NEAR PARK VALLEY, UT"	Active	None	---	---	Yes	---	---
10174500	"SEVIER RIVER AT HATCH, UT"	Active	Full	---	---	---	---	Yes
10180000	"SEVIER RIVER NEAR CIRCLEVILLE, UT"	Inactive	None	---	---	---	---	Yes
