07050000	"WHITE RIVER AT BEAVER, ARK."	Inactive	None	---	---	---	---	Yes
07050500	"Kings River near Berryville, AR"	Active	Full	Yes	Yes	---	---	Yes
07052500	"James River at Galena, MO"	Active	None	---	---	---	---	Yes
07053250	"Yocum Creek near Oak Grove, AR"	Active	Full	Yes	---	---	---	---
07053500	"White River near Branson, MO"	Inactive	None	---	Yes	---	---	Yes
07055646	"Buffalo River near Boxley, AR"	Active	Partial	Yes	---	---	---	---
07056000	"Buffalo River near St. Joe, AR"	Active	Partial	---	---	---	---	Yes
07056700	"Buffalo River near Harriet, AR"	Active	Full	---	---	---	---	Yes
07057370	"White River near Norfork, AR"	Active	Partial	---	---	---	---	Yes
07057500	"North Fork River near Tecumseh, MO"	Active	None	---	Yes	---	---	Yes
07058000	"Bryant Creek near Tecumseh, MO"	Active	None	---	Yes	---	---	---
07059500	"Norfork Lake near Norfork, AR"	Active	None	---	---	---	---	Yes
07060500	"White River at Calico Rock, AR"	Active	Partial	---	---	---	---	Yes
07060710	"North Sylamore Creek near Fifty Six, AR"	Active	Partial	Yes	---	---	---	---
07061000	"White River at Batesville, AR"	Active	Full	---	---	---	---	Yes
07061500	"Black River near Annapolis, MO"	Active	None	---	---	---	---	Yes
07062500	"Black River at Leeper, MO"	Active	None	---	---	---	---	Yes
07063000	"Black River at Poplar Bluff, MO"	Active	None	---	---	---	---	Yes
07064000	"Black River near Corning, AR"	Active	Partial	---	Yes	---	---	Yes
07065495	"Jacks Fork at Alley Spring, MO"	Active	Partial	---	---	---	---	Yes
07066000	"Jacks Fork at Eminence, MO"	Active	Full	---	---	---	Yes	Yes
07067000	"Current River at Van Buren, MO"	Active	Partial	---	---	---	---	Yes
07068000	"Current River at Doniphan, MO"	Active	Partial	---	Yes	---	---	Yes
07069000	"Black River at Pocahontas, AR"	Active	Partial	---	---	---	---	Yes
07069220	"Spring River near Mammoth Springs, AR"	Active	Full	---	---	---	---	Yes
07069295	"South Fork Spring River at Saddle, AR"	Active	Full	---	---	---	---	Yes
07069305	"Spring River at Spring Street Bridge at Hardy, AR"	Active	Full	---	---	---	---	Yes
07069500	"Spring River at Imboden, AR"	Active	Partial	---	---	---	---	Yes
07071500	"Eleven Point River near Bardley, MO"	Active	Partial	---	Yes	---	---	---
07072000	"Eleven Point River near Ravenden Springs, AR"	Active	Partial	---	---	---	---	Yes
07072500	"Black River at Black Rock, AR"	Active	None	---	---	---	---	Yes
07074500	"White River at Newport, AR"	Active	None	---	---	---	---	Yes
07074850	"White River near Augusta, AR"	Active	Full	---	---	Yes	---	Yes
07075300	"South Fork of Little Red River at Clinton, AR"	Active	Partial	---	---	---	Yes	---
07075900	"Greers Ferry Lake near Heber Springs, AR"	Active	None	---	---	---	---	Yes
07076634	"Little Red River at Judsonia, AR"	Active	None	---	---	---	---	Yes
07076850	"CYPRESS BAYOU NEAR BEEBE, ARK"	Inactive	None	---	---	---	Yes	---
07077380	"Cache River at Egypt, AR"	Active	Partial	---	---	---	---	Yes
07077500	"Cache River at Patterson, AR"	Active	None	---	---	---	---	Yes
07077820	"WHITE RIVER AT ST. CHARLES, ARK."	Inactive	None	---	---	Yes	---	---
07077950	BIG CREEK AT POPLAR GROVE	Inactive	None	---	---	---	Yes	---
07078296	"AR Post Canal at Lock No. 2 near Tichnor, AR"	Inactive	None	---	---	---	---	Yes
07081200	"ARKANSAS RIVER NEAR LEADVILLE, CO"	Active	None	---	---	---	---	Yes
07083000	"HALFMOON CREEK NEAR MALTA, CO"	Active	Partial	Yes	---	---	Yes	---
07083710	"ARKANSAS RIVER BELOW EMPIRE GULCH NEAR MALTA, CO"	Active	Partial	---	---	---	---	Yes
07086000	"ARKANSAS RIVER AT GRANITE, CO."	Active	None	---	---	---	---	Yes
07087200	"ARKANSAS RIVER AT BUENA VISTA, CO."	Inactive	None	---	---	---	---	Yes
07091000	"CHALK CREEK NEAR NATHROP, CO."	Inactive	None	---	---	---	---	Yes
07091200	"ARKANSAS RIVER NEAR NATHROP, CO"	Active	Partial	---	---	---	---	Yes
07091500	"ARKANSAS RIVER AT SALIDA, CO."	Inactive	None	---	---	---	---	Yes
07094500	"ARKANSAS RIVER AT PARKDALE, CO."	Active	Partial	---	---	---	---	Yes
07095000	"GRAPE CREEK NEAR WESTCLIFFE, CO."	Inactive	None	---	---	---	---	Yes
07096000	"ARKANSAS RIVER AT CANON CITY, CO."	Active	None	---	---	---	---	Yes
07097000	"ARKANSAS RIVER AT PORTLAND, CO."	Active	None	---	---	---	---	Yes
07099400	"ARKANSAS RIVER ABOVE PUEBLO, CO"	Active	None	---	---	---	---	Yes
07099500	"ARKANSAS RIVER NEAR PUEBLO, CO."	Inactive	None	---	---	---	---	Yes
07099990	"FOUNTAIN CREEK AT GREEN MOUNTAIN FALLS, CO"	Inactive	None	---	Yes	---	---	Yes
07103700	"FOUNTAIN CREEK NEAR COLORADO SPRINGS, CO."	Active	Partial	---	---	---	---	Yes
07105800	"FOUNTAIN CREEK AT SECURITY, CO"	Active	Partial	---	---	---	---	Yes
07106500	"FOUNTAIN CREEK AT PUEBLO, CO."	Active	Full	---	---	---	---	Yes
07108900	"ST. CHARLES RIVER AT VINELAND, CO."	Active	Full	---	---	---	---	Yes
07109500	"ARKANSAS RIVER NEAR AVONDALE, CO."	Active	None	---	---	---	---	Yes
07111000	"HUERFANO R AT MANZANARES XING, NR REDWING, CO."	Inactive	None	---	---	---	---	Yes
07114000	"CUCHARAS RIVER AT BOYD RANCH, NEAR LA VETA, CO."	Inactive	None	---	---	---	---	Yes
07116500	"HUERFANO RIVER NEAR BOONE, CO."	Active	Full	---	---	---	---	Yes
07119500	"APISHAPA RIVER NEAR FOWLER, CO"	Active	Partial	---	Yes	---	---	Yes
07123000	"ARKANSAS RIVER AT LA JUNTA, CO"	Inactive	None	---	---	---	---	Yes
07124000	"ARKANSAS RIVER AT LAS ANIMAS, CO."	Active	Full	---	Yes	---	---	Yes
07124200	"PURGATOIRE RIVER AT MADRID, CO."	Active	None	---	---	---	---	Yes
07124500	"PURGATOIRE RIVER AT TRINIDAD, CO."	Inactive	None	---	---	---	---	Yes
07126200	"VAN BREMER ARROYO NEAR MODEL, CO"	Active	None	---	---	---	Yes	---
07128500	"PURGATOIRE RIVER NEAR LAS ANIMAS, CO"	Active	Full	---	Yes	---	---	Yes
07130500	"ARKANSAS RIVER BELOW JOHN MARTIN RESERVOIR, CO."	Active	Full	---	Yes	---	---	---
07133000	"ARKANSAS RIVER AT LAMAR, CO"	Active	Full	---	Yes	---	---	Yes
07134180	"ARKANSAS RIVER NEAR GRANADA, CO."	Active	Full	---	Yes	---	---	Yes
07134990	"WILD HORSE CREEK ABOVE HOLLY, CO"	Active	Partial	---	---	---	Yes	---
07135000	"TWO BUTTE CREEK NEAR HOLLY, CO."	Inactive	None	---	Yes	---	---	---
07135500	"ARKANSAS RIVER AT HOLLY, CO."	Inactive	None	---	---	Yes	---	---
07137000	"FRONTIER DITCH NR COOLIDGE, KS"	Active	None	---	Yes	---	---	---
07137500	"ARKANSAS R NR COOLIDGE, KS"	Active	Full	---	Yes	---	---	Yes
07138000	"ARKANSAS R AT SYRACUSE, KS"	Active	Full	---	---	---	---	Yes
07138650	"WHITE WOMAN C NR LEOTI, KS"	Inactive	None	---	---	---	Yes	---
07139000	"ARKANSAS R AT GARDEN CITY, KS"	Active	None	---	Yes	---	---	Yes
07139500	"ARKANSAS R AT DODGE CITY, KS"	Active	None	---	---	---	---	Yes
07140850	"PAWNEE R NR BURDETT, KS"	Active	None	---	---	---	---	Yes
07141175	"BUCKNER C NR BURDETT, KS"	Inactive	None	---	---	---	---	Yes
07141200	"PAWNEE R AT ROZEL, KS"	Active	None	---	---	---	---	Yes
07141300	"ARKANSAS R AT GREAT BEND, KS"	Active	None	---	---	---	---	Yes
07141770	"WALNUT C NR ALEXANDER, KS"	Inactive	None	---	---	---	---	Yes
07141780	"WALNUT C AT NEKOMA, KS"	Active	None	---	---	---	---	Yes
07141900	"WALNUT C AT ALBERT, KS"	Active	None	---	---	---	---	Yes
07142300	"RATTLESNAKE C NR MACKSVILLE, KS"	Active	None	---	---	---	---	Yes
07142575	"RATTLESNAKE C NR ZENITH, KS"	Active	None	---	---	---	---	Yes
07143300	"COW C NR LYONS, KS"	Active	Full	---	---	---	---	Yes
07143330	"ARKANSAS R NR HUTCHINSON, KS"	Active	None	---	---	---	---	Yes
07143375	"ARKANSAS R NR MAIZE, KS"	Active	None	---	---	---	---	Yes
07143672	"L ARKANSAS R AT HWY 50 NR HALSTEAD, KS"	Active	None	---	---	---	---	Yes
07144050	"EMMA C AT SEDGWICK, KS"	Active	None	---	---	---	---	Yes
07144100	"L ARKANSAS R NR SEDGWICK, KS"	Active	None	---	---	---	---	Yes
07144200	"L ARKANSAS R AT VALLEY CENTER, KS"	Active	Full	---	---	---	Yes	---
07144300	"ARKANSAS R AT WICHITA, KS"	Active	None	---	---	---	---	Yes
07144480	"COWSKIN C AT 119TH ST AT WICHITA, KS"	Active	Full	---	---	---	---	Yes
07144550	"ARKANSAS R AT DERBY, KS"	Active	None	---	---	---	---	Yes
07144570	"ARKANSAS R AT MULVANE, KS"	Active	Full	---	---	---	---	Yes
07144780	"NF NINNESCAH R AB CHENEY RE, KS"	Active	None	---	---	---	---	Yes
07144910	"SF NINNESCAH R NR PRATT, KS"	Active	None	---	---	---	---	Yes
07145200	"SF NINNESCAH R NR MURDOCK, KS"	Active	None	---	---	---	---	Yes
07145500	"NINNESCAH R NR PECK, KS"	Active	None	---	---	---	---	Yes
07145600	"ARKANSAS R ON HWY 160 AT OXFORD, KS"	Active	None	---	---	---	---	Yes
07145700	"SLATE C AT WELLINGTON, KS"	Active	None	---	---	---	---	Yes
07146500	"ARKANSAS R AT ARKANSAS CITY, KS"	Active	Partial	---	Yes	Yes	---	Yes
07146800	"WB WALNUT R NR EL DORADO, KS"	Active	Partial	---	---	---	---	Yes
07146830	"WALNUT R AT HWY 54 E OF EL DORADO, KS"	Inactive	None	---	---	---	Yes	Yes
07146895	"WALNUT R AT AUGUSTA, KS"	Inactive	None	---	---	---	---	Yes
07147070	"WHITEWATER R AT TOWANDA, KS"	Active	None	---	---	---	---	Yes
07147190	"WHITEWATER R AT AUGUSTA, KS"	Active	Partial	---	---	---	---	Yes
07147900	"WALNUT R AT ARKANSAS CITY, KS"	Active	Full	---	---	---	---	Yes
07148100	"GROUSE C NR DEXTER, KS"	Inactive	Full	---	---	---	Yes	---
07148350	"Salt Fork Arkansas River nr Winchester, OK"	Inactive	None	---	---	---	Yes	Yes
07148400	"Salt Fork Arkansas River nr Alva, OK"	Active	Partial	---	Yes	---	---	---
07149000	"MEDICINE LODGE R NR KIOWA, KS"	Active	Full	---	Yes	---	---	Yes
07150500	"Salt Fork Arkansas River nr Jet, OK"	Inactive	None	---	---	---	---	Yes
07151000	"Salt Fork Arkansas River at Tonkawa, OK"	Active	Partial	---	Yes	---	---	Yes
07151500	"CHIKASKIA R NR CORBIN, KS"	Active	Partial	---	Yes	---	Yes	Yes
07152000	"Chikaskia River near Blackwell, OK"	Active	Partial	---	Yes	---	---	Yes
07152500	"Arkansas River at Ralston, OK"	Active	Partial	---	---	Yes	---	Yes
07153000	"Black Bear Creek at Pawnee, OK"	Active	Partial	---	---	---	---	Yes
07154500	"Cimarron River near Kenton, OK"	Active	Partial	---	Yes	---	Yes	---
07155590	"CIMARRON R NR ELKHART, KS"	Active	Full	---	---	---	---	Yes
07156100	"SAND ARROYO C NR JOHNSON, KS"	Inactive	None	---	Yes	---	---	---
07156220	"BEAR C NR JOHNSON, KS"	Inactive	None	---	---	---	Yes	---
07156900	"Cimarron River near Forgan, OK"	Active	Full	---	Yes	---	---	Yes
07157500	"CROOKED C NR ENGLEWOOD, KS"	Active	Full	---	Yes	---	---	Yes
07157740	"Cimarron R near Buttermilk, KS"	Active	Full	---	Yes	---	---	---
07157940	"BLUFF C NR BUTTERMILK, KS"	Active	Full	---	---	---	Yes	---
07157950	"Cimarron River near Buffalo, OK"	Active	Full	---	---	Yes	---	Yes
07158000	"Cimarron River near Waynoka, OK"	Active	Partial	---	---	---	---	Yes
07159100	"Cimarron River near Dover, OK"	Active	Partial	---	---	---	---	Yes
07159750	"Cottonwood Creek near Seward, OK"	Active	Partial	---	---	---	---	Yes
07160000	"Cimarron River near Guthrie, OK"	Active	Partial	---	---	---	---	Yes
07160500	"Skeleton Creek near Lovell, OK"	Active	Full	---	---	---	Yes	---
07161000	"Cimarron River at Perkins, OK"	Inactive	None	---	---	---	---	Yes
07161450	"Cimarron River near Ripley, OK"	Active	None	---	---	Yes	---	---
07163000	"Council Creek near Stillwater, OK"	Inactive	None	---	---	---	Yes	---
07164500	"Arkansas River at Tulsa, OK"	Active	Partial	---	---	---	---	Yes
07165565	"Little Haikey Creek at 101st St South at Tulsa, OK"	Active	None	---	---	---	Yes	---
07165570	"Arkansas River near Haskell, OK"	Active	None	---	Yes	---	---	Yes
07165750	"VERDIGRIS R NR VIRGIL, KS"	Active	Partial	---	---	---	---	Yes
07166000	"VERDIGRIS R NR COYVILLE, KS"	Inactive	None	---	---	---	---	Yes
07166500	"VERDIGRIS R NR ALTOONA, KS"	Active	None	---	---	---	---	Yes
07167500	"OTTER C AT CLIMAX, KS"	Active	None	---	---	---	---	Yes
07168500	"FALL R NR FALL RIVER, KS"	Inactive	None	---	---	---	---	Yes
07169500	"FALL R AT FREDONIA, KS"	Active	None	---	---	---	---	Yes
07169800	"ELK R AT ELK FALLS, KS"	Active	Partial	---	---	---	---	Yes
07170500	"VERDIGRIS R AT INDEPENDENCE, KS"	Active	None	---	---	---	---	Yes
07170990	"VERDIGRIS R AT COFFEYVILLE, KS"	Active	None	---	---	---	---	Yes
07171000	"Verdigris River near Lenapah, OK"	Active	Partial	---	Yes	---	---	Yes
07171400	"Verdigris River near Oologah, OK"	Inactive	None	---	---	---	---	Yes
07172000	"CANEY R NR ELGIN, KS"	Active	Partial	---	---	---	Yes	---
07174400	"Caney River above Coon Creek at Bartlesville, OK"	Active	Partial	---	---	---	---	Yes
07175500	"Caney River near Ramona, OK"	Active	None	---	Yes	---	---	Yes
07176000	"Verdigris River near Claremore, OK"	Active	None	---	Yes	Yes	---	Yes
07176465	"Birch Creek blw Birch Lake nr Barnsdall, OK"	Inactive	None	---	---	---	---	Yes
07176500	"Bird Creek at Avant, OK"	Active	Partial	---	---	---	---	Yes
07176800	"Candy Creek near Wolco, OK"	Inactive	None	---	---	---	Yes	---
07177500	"Bird Creek near Sperry, OK"	Active	Partial	---	---	---	---	Yes
07177650	"Flat Rock Creek at Cincinnati Ave at Tulsa, OK"	Active	None	---	---	---	Yes	---
07178000	"Bird Creek near Owasso, OK"	Active	Partial	---	---	---	---	Yes
07178200	"Bird Ck at State Highway 266 near Catoosa, OK"	Active	Full	---	Yes	Yes	---	---
07179300	"NEOSHO R NR PARKERVILLE, KS"	Active	Partial	---	---	---	---	Yes
07179500	"NEOSHO R AT COUNCIL GROVE, KS"	Active	None	---	---	---	---	Yes
07179700	"ROCK C NR DUNLAP, KS"	Active	Full	---	---	---	---	Yes
07179730	"NEOSHO R NR AMERICUS, KS"	Active	None	---	---	---	---	Yes
07179750	"NEOSHO R AT BURLINGAME RD NR EMPORIA, KS"	Active	None	---	---	---	---	Yes
07179785	"NF COTTONWOOD R NR DURHAM, KS"	Active	None	---	---	---	Yes	---
07180400	"COTTONWOOD R NR FLORENCE, KS"	Active	None	---	---	---	---	Yes
07180500	"CEDAR C NR CEDAR POINT, KS"	Active	Partial	---	---	---	Yes	---
07182200	"SF COTTONWOOD R NR BAZAAR, KS"	Active	Full	---	---	---	---	Yes
07182250	"COTTONWOOD R NR PLYMOUTH, KS"	Active	None	---	---	---	---	Yes
07182260	"COTTONWOOD R AT EMPORIA, KS"	Active	Partial	---	---	---	---	Yes
07182390	"NEOSHO R AT NEOSHO RAPIDS, KS"	Active	Full	---	---	---	---	Yes
07182510	"NEOSHO R AT BURLINGTON, KS"	Active	Partial	---	---	---	---	Yes
07183000	"NEOSHO R NR IOLA, KS"	Active	None	---	---	---	---	Yes
07183300	"NEOSHO R NR ERIE, KS"	Active	None	---	---	---	---	Yes
07183500	"NEOSHO R NR PARSONS, KS"	Active	Partial	---	---	---	---	Yes
07184500	"LABETTE C NR OSWEGO, KS"	Active	Full	---	---	---	---	Yes
07185000	"Neosho River near Commerce, OK"	Active	Partial	---	Yes	---	---	Yes
07185765	"Spring River at Carthage, MO"	Active	Full	---	---	---	---	Yes
07186000	"Spring River near Waco, MO"	Active	Full	---	Yes	---	Yes	Yes
07187000	"Shoal Creek above Joplin, MO"	Active	Partial	---	---	---	---	Yes
07187600	"SPRING R NR BAXTER SPRINGS, KS"	Active	None	---	---	---	---	Yes
07188000	"Spring River near Quapaw, OK"	Active	None	---	Yes	---	---	Yes
07189000	"Elk River near Tiff City, Mo"	Active	None	---	Yes	---	Yes	Yes
07190500	"Neosho River near Langley, OK"	Active	None	---	---	---	---	Yes
07191220	"Spavinaw Creek near Sycamore, OK"	Active	None	---	Yes	---	---	---
07191500	"Neosho River near Chouteau, OK"	Active	None	---	---	Yes	---	Yes
07194500	"Arkansas River near Muskogee, OK"	Active	Full	---	Yes	---	---	Yes
07194800	"Illinois River at Savoy, AR"	Active	Full	---	Yes	---	---	---
07195000	"Osage Creek near Elm Springs, AR"	Active	Full	---	Yes	---	---	Yes
07195400	Illinois River at Hwy. 16 near Siloam Springs AR	Active	Full	---	---	---	---	Yes
07195430	"Illinois River South of Siloam Springs, AR"	Active	Partial	---	Yes	---	---	---
07195500	"Illinois River near Watts, OK"	Active	Partial	---	Yes	---	---	Yes
07196000	"Flint Creek near Kansas, OK"	Active	Partial	---	Yes	---	---	Yes
07196500	"Illinois River near Tahlequah, OK"	Active	Partial	---	Yes	---	---	Yes
07196900	"Baron Fork at Dutch Mills, AR"	Active	Partial	---	Yes	---	---	---
07197000	"Baron Fork at Eldon, OK"	Active	Partial	---	Yes	---	Yes	Yes
07198000	"Illinois River near Gore, OK"	Active	None	---	---	---	---	Yes
07203000	"VERMEJO RIVER NEAR DAWSON, NM"	Active	Partial	---	---	---	Yes	Yes
07206000	"CIMARRON RIVER BELOW EAGLE NEST DAM, NM"	Active	Partial	---	---	---	---	Yes
07207000	"CIMARRON RIVER NEAR CIMARRON, NM"	Active	Full	---	---	---	---	Yes
07207500	"PONIL CREEK NEAR CIMARRON, NM"	Active	Partial	---	---	---	---	Yes
07208500	"RAYADO CREEK NEAR CIMARRON, NM"	Active	Full	---	---	---	---	Yes
07211500	"CANADIAN RIVER NEAR TAYLOR SPRINGS, NM"	Active	Partial	---	---	---	---	Yes
07216500	"MORA RIVER NEAR GOLONDRINAS, NM"	Active	Full	---	---	---	---	Yes
07221500	"CANADIAN RIVER NEAR SANCHEZ, NM"	Active	Partial	---	---	---	---	Yes
07226500	"UTE CREEK NEAR LOGAN, NM"	Active	Full	---	---	---	Yes	---
07227000	"CANADIAN RIVER AT LOGAN, NM"	Active	Full	---	Yes	---	---	---
07227100	"REVUELTO CREEK NEAR LOGAN, NM"	Active	Full	---	Yes	Yes	---	---
07227200	"TRAMPEROS CREEK NEAR STEAD, NM"	Inactive	None	---	Yes	---	---	---
07227800	"Big Blue Ck nr Dumas, TX"	Inactive	None	---	---	---	Yes	---
07227920	"Dixon Ck nr Borger, TX"	Inactive	None	---	---	---	Yes	---
07228000	"Canadian Rv nr Canadian, TX"	Active	Full	---	---	Yes	---	Yes
07228500	"Canadian River at Bridgeport, OK"	Active	Partial	---	---	---	---	Yes
07229200	"Canadian River at Purcell, OK"	Active	Partial	---	Yes	---	---	Yes
07229300	"Walnut Creek at Purcell, OK"	Active	Full	---	---	---	Yes	---
07230597	"Little River near Bowlegs, OK"	Inactive	None	---	---	---	---	Yes
07231000	"Little River near Sasakwa, OK"	Active	Full	---	---	---	Yes	Yes
07231500	"Canadian River at Calvin, OK"	Active	Partial	---	---	---	---	Yes
07232250	"Beaver River near Felt, OK"	Inactive	None	---	Yes	---	---	---
07232500	"Beaver River near Guymon, OK"	Inactive	None	---	---	---	---	Yes
07232900	"Coldwater Creek near Guymon, OK"	Inactive	None	---	Yes	---	---	---
07233210	"Beaver River near Hardesty, OK"	Inactive	None	---	---	---	---	Yes
07233500	"Palo Duro Ck nr Spearman, TX"	Active	Full	---	---	---	Yes	Yes
07233650	"Palo Duro Creek at Range, OK"	Inactive	None	---	Yes	---	---	---
07234000	"Beaver River at Beaver, OK"	Active	None	---	Yes	Yes	---	Yes
07234100	"Clear Creek near Elmwood, OK"	Inactive	None	---	---	---	Yes	---
07235500	"Wolf Creek near Shattuck, OK"	Inactive	Partial	---	Yes	---	---	---
07237000	"Wolf Creek near Fort Supply, OK"	Inactive	None	---	---	---	---	Yes
07237500	"North Canadian River at Woodward, OK"	Active	Partial	---	Yes	Yes	---	Yes
07238000	"North Canadian River near Seiling, OK"	Active	None	---	Yes	---	---	Yes
07239450	"North Canadian River near Calumet, OK"	Active	Full	---	---	---	---	Yes
07239500	"North Canadian River near El Reno, OK"	Active	Full	---	---	---	---	Yes
07241520	"North Canadian River at Britton Rd at OKC, OK"	Active	Full	---	---	---	---	Yes
07242000	"North Canadian River near Wetumka, OK"	Active	Partial	---	---	Yes	---	Yes
07243000	"Dry Creek near Kendrick, OK"	Inactive	None	---	---	---	Yes	---
07243500	"Deep Fork near Beggs, OK"	Active	None	---	---	Yes	---	Yes
07245000	"Canadian River near Whitefield, OK"	Active	Partial	---	---	Yes	---	---
07245030	"Taloka Creek near Stigler, OK"	Inactive	None	---	---	---	Yes	---
07247000	"Poteau River at Cauthron, AR"	Active	Partial	---	Yes	---	---	---
07247015	"Poteau River at Loving, OK"	Active	Partial	---	Yes	---	---	---
07247250	"Black Fork below Big Creek nr Page, OK"	Active	None	---	Yes	---	---	---
07247500	"Fourche Maline near Red Oak, OK"	Active	Partial	---	---	---	Yes	---
07249400	"James Fork near Hackett, AR"	Active	Partial	---	Yes	---	Yes	---
07249413	"Poteau River near Panama, OK"	Active	None	---	---	---	---	Yes
07249455	"Arkansas River at Ft. Smith, Ar."	Active	Partial	---	Yes	---	---	---
07249500	"Cove Creek near Lee Creek, AR"	Inactive	None	---	---	---	Yes	---
07250085	"Lee Creek at Lee Creek Reservoir near Van Buren,AR"	Active	Partial	---	---	---	---	Yes
07250550	"AR River at James W. Trimble L&amp;D nr Van Buren, AR"	Active	Partial	---	Yes	Yes	---	Yes
07252000	"Mulberry River near Mulberry, AR"	Active	None	---	---	---	Yes	Yes
07252405	"Ozark Lake at Ozark, AR"	Inactive	None	---	---	---	---	Yes
07258000	"Arkansas River at Dardanelle, AR"	Active	Partial	---	---	---	---	Yes
07259500	"PETIT JEAN RIVER AT BLUE MOUNTAIN DAM TW,"	Inactive	None	---	---	---	---	Yes
07260800	"Arkansas River near Morrilton, AR"	Active	None	---	---	---	---	Yes
07261000	"Cadron Creek near Guy, AR"	Active	Full	---	---	---	Yes	---
07261260	"AR River @ Toad Suck Ferry Dam near Conway, AR"	Inactive	None	---	---	---	---	Yes
07261500	"Fourche LaFave River Near Gravelly, AR"	Active	Full	---	---	---	Yes	---
07262500	"FOURCHE LA FAVE RIVER AT  NIMROD DAM TW,"	Inactive	None	---	---	---	---	Yes
07263012	"Fourche LaFave River near Aplin, AR"	Active	Full	---	---	---	---	Yes
07263450	"Arkansas River at Murray Dam near Little Rock, AR"	Active	Full	---	---	---	---	Yes
07263580	"Rock Creek at 36th Street at Little Rock, AR"	Active	Full	---	---	---	Yes	---
07263620	"AR River@David D Terry L&amp;D below Little Rock, AR"	Active	None	Yes	---	---	---	---
07263640	"AR River @ Lock and Dam 5 near Wright, AR"	Inactive	None	---	---	---	---	Yes
07263650	"Arkansas River at Pine Bluff, AR"	Active	None	---	---	Yes	---	---
07265280	"Arkansas River at Pendleton, AR"	Active	None	---	---	Yes	---	---
07265450	"MISSISSIPPI RIV NR ARKANSAS CITY, AR"	Inactive	None	---	---	Yes	---	---
07268000	"LITTLE TALLAHATCHIE RIVER AT ETTA, MS"	Active	Full	---	---	---	Yes	Yes
07271000	"CLEAR CREEK NR OXFORD, MS"	Inactive	None	---	---	---	Yes	---
07273000	"TALLAHATCHIE RIVER NR SARDIS, MS"	Inactive	None	---	---	---	---	Yes
07274000	"YOCONA RIVER NR OXFORD, MS"	Active	Partial	---	---	---	---	Yes
07275900	"COLDWATER RIVER NR OLIVE BRANCH, MS"	Active	Full	---	---	---	---	Yes
07279500	"COLDWATER RIVER AT SAVAGE, MS"	Inactive	None	---	---	---	---	Yes
07282000	"YALOBUSHA R AND TOPASHAW C CA AT CALHOUN CITY, MS"	Active	None	---	---	---	---	Yes
07283000	"SKUNA RIVER AT BRUCE, MS"	Active	Partial	---	---	---	---	Yes
07288280	"BIG SUNFLOWER RIVER NR MERIGOLD, MS"	Active	None	---	---	---	---	Yes
07288500	"BIG SUNFLOWER RIVER AT SUNFLOWER, MS"	Active	None	---	---	---	Yes	---
07288650	"BOGUE PHALIA NR LELAND, MS"	Active	None	Yes	---	---	---	---
07288955	"YAZOO RIVER BL STEELE BAYOU NR LONG LAKE, MS"	Active	Full	Yes	---	Yes	---	---
07289000	"MISSISSIPPI RIVER AT VICKSBURG, MS"	Active	None	---	---	Yes	---	---
07289350	"BIG BLACK RIVER AT WEST, MS"	Active	None	---	---	---	Yes	Yes
07289500	"BIG BLACK RIVER AT PICKENS, MS"	Inactive	None	---	---	---	---	Yes
07289730	"BIG BLACK RIVER NR BENTONIA, MS"	Active	Full	---	---	---	---	Yes
07290000	"BIG BLACK RIVER NR BOVINA, MS"	Active	None	---	---	Yes	---	Yes
07291000	"HOMOCHITTO RIVER AT EDDICETON, MS"	Active	Full	---	---	---	Yes	---
07292500	"HOMOCHITTO RIVER AT ROSETTA, MS"	Active	Full	---	---	Yes	---	Yes
07295100	"Mississippi River at Tarbert Landing, MS"	Active	None	---	Yes	Yes	---	---
07297910	"Pr Dog Twn Fk Red Rv nr Wayside, TX"	Active	Full	---	---	---	Yes	---
07299300	"Little Red Rv nr Turkey, TX"	Inactive	None	---	---	---	Yes	---
07299530	"Salt Ck nr Estelline, TX"	Inactive	None	---	---	---	Yes	---
07299540	"Pr Dog Twn Fk Red Rv nr Childress, TX"	Active	Full	---	---	Yes	---	---
07299670	"Groesbeck Ck at SH 6 nr Quanah, TX"	Active	Full	---	---	---	Yes	---
07299890	"Lelia Lk Ck bl Bell Ck nr Hedley, TX"	Active	None	---	---	---	Yes	---
07300000	"Salt Fork Red River near Wellington, TX"	Active	Full	---	Yes	---	---	---
07300580	"Bitter Creek West of Altus, OK"	Inactive	None	---	---	---	Yes	---
07301110	"Salt Fork Red River near Elmer, OK"	Active	None	---	---	Yes	---	---
07301195	"McClellan Ck nr Boydston, TX"	Inactive	None	---	---	---	Yes	---
07301300	"N Fk Red Rv nr Shamrock, TX"	Active	Partial	---	Yes	---	---	Yes
07301420	"Sweetwater Creek near Sweetwater, OK"	Active	Partial	---	---	---	Yes	---
07301500	"North Fork Red River near Carter, OK"	Active	Partial	---	---	---	---	Yes
07302500	"Lake Altus at Lugert, OK"	Active	None	---	---	---	---	Yes
07303400	"Elm Fork of North Fork Red River nr Carl, OK"	Active	None	---	---	---	Yes	---
07305000	"North Fork Red River near Headrick, OK"	Active	Partial	---	---	---	---	Yes
07307028	"North Fork Red River near Tipton, OK"	Active	Partial	---	---	Yes	---	---
07307500	"Quitaque Ck nr Quitaque, TX"	Inactive	None	---	---	---	Yes	---
07307750	"Middle Pease Rv at Hwy 62 and 83 nr Paducah, TX"	Inactive	None	---	---	---	Yes	---
07308500	"Red Rv nr Burkburnett, TX"	Active	Full	---	Yes	Yes	---	Yes
07311000	"East Cache Creek near Walters, OK"	Active	Partial	---	---	---	---	Yes
07311200	"Blue Beaver Creek near Cache, OK"	Inactive	None	---	---	---	Yes	---
07311500	"Deep Red Creek near Randlett, OK"	Active	Partial	---	---	---	---	Yes
07311600	"N Wichita Rv nr Paducah, TX"	Inactive	None	---	---	---	Yes	---
07312100	"Wichita Rv nr Mabelle, TX"	Active	Partial	---	---	---	---	Yes
07312200	"Beaver Ck nr Electra, TX"	Active	Partial	---	---	---	---	Yes
07312500	"Wichita Rv at Wichita Falls, TX"	Active	Full	---	---	---	---	Yes
07315200	"E Fk Little Wichita Rv nr Henrietta, TX"	Active	None	---	---	---	Yes	---
07315500	"Red River near Terral, OK"	Active	Partial	---	Yes	---	---	Yes
07316000	"Red River near Gainesville, TX"	Active	Partial	---	Yes	---	---	Yes
07316300	"Washita Rv nr Washita, TX"	Inactive	None	---	---	---	Yes	---
07316500	"Washita River near Cheyenne, OK"	Active	Partial	---	---	---	---	Yes
07324300	"Foss Reservoir near Foss, OK"	Active	None	---	---	---	---	Yes
07325000	"Washita River near Clinton, OK"	Active	None	---	---	---	---	Yes
07325500	"Washita River at Carnegie, OK"	Active	None	---	---	---	---	Yes
07325800	"Cobb Creek near Eakly, OK"	Active	Partial	---	---	---	Yes	---
07326000	"Cobb Creek near Fort Cobb, OK"	Active	None	---	---	---	---	Yes
07326500	"Washita River at Anadarko, OK"	Active	None	---	---	---	---	Yes
07328070	"Winter Creek near Alex, OK"	Inactive	None	---	---	---	Yes	---
07328100	"Washita River at Alex, OK"	Active	None	---	---	---	---	Yes
07328500	"Washita River near Pauls Valley, OK"	Active	Partial	---	---	---	---	Yes
