05020500	St. Mary River at International Boundary	Active	None	---	Yes	---	---	Yes
05030000	"OTTER TAIL RIVER NEAR DETROIT LAKES, MN"	Inactive	None	---	---	---	Yes	---
05040500	"PELICAN RIVER NEAR FERGUS FALLS, MN"	Inactive	None	---	---	---	Yes	---
05050000	"BOIS DE SIOUX RIVER NEAR WHITE ROCK, SD"	Active	None	---	Yes	---	---	Yes
05051000	"RABBIT RIVER AT CAMPBELL, MN"	Inactive	None	---	---	---	---	Yes
05051500	"RED RIVER OF THE NORTH AT WAHPETON, ND"	Active	Full	---	---	---	---	Yes
05051522	"RED RIVER OF THE NORTH AT HICKSON, ND"	Active	Full	---	Yes	---	---	---
05051600	"WILD RICE RIVER NR RUTLAND, ND"	Active	None	---	---	---	Yes	---
05053000	"WILD RICE RIVER NR ABERCROMBIE, ND"	Active	Full	---	---	---	---	Yes
05054000	"RED RIVER OF THE NORTH AT FARGO, ND"	Active	Full	---	---	---	---	Yes
05056500	"DEVILS LAKE NR DEVILS LAKE, ND"	Active	None	---	---	---	---	Yes
05057000	"SHEYENNE RIVER NR COOPERSTOWN, ND"	Active	None	---	---	---	Yes	---
05058500	"SHEYENNE RIVER AT VALLEY CITY, ND"	Active	None	---	---	---	---	Yes
05058700	"SHEYENNE RIVER AT LISBON, ND"	Active	Full	---	---	---	---	Yes
05059000	"SHEYENNE RIVER NEAR KINDRED, ND"	Active	Full	---	---	---	---	Yes
05059480	"SHEYENNE RIVER DIVERSION AT WEST FARGO, ND"	Active	None	---	---	---	---	Yes
05059500	"SHEYENNE RIVER AT WEST FARGO, ND"	Active	None	---	---	Yes	---	---
05059700	"MAPLE RIVER NR ENDERLIN, ND"	Active	Full	---	---	---	---	Yes
05060000	"MAPLE RIVER NR MAPLETON, ND"	Active	None	---	---	---	---	Yes
05060400	"SHEYENNE RIVER AT HARWOOD, ND"	Active	None	---	---	---	---	Yes
05060500	"RUSH RIVER AT AMENIA, ND"	Active	Full	---	---	---	Yes	---
05061000	"BUFFALO RIVER NEAR HAWLEY, MN"	Active	Partial	---	---	---	---	Yes
05061500	"SOUTH BRANCH BUFFALO RIVER AT SABIN, MN"	Active	Partial	---	---	---	Yes	Yes
05062000	"BUFFALO RIVER NEAR DILWORTH, MN"	Active	Full	---	---	---	---	Yes
05062435	"WHITE EARTH RIVER NEAR MAHNOMEN, MN"	Inactive	None	---	---	---	---	Yes
05062440	"WILD RICE RIVER AT MAHNOMEN, MN"	Inactive	None	---	---	---	---	Yes
05062500	"WILD RICE RIVER AT TWIN VALLEY, MN"	Active	Partial	---	---	---	---	Yes
05064000	"WILD RICE RIVER AT HENDRUM, MN"	Active	Partial	---	---	---	---	Yes
05064500	"RED RIVER OF THE NORTH AT HALSTAD, MN"	Active	Full	---	---	Yes	---	Yes
05064900	"BEAVER CREEK NR FINLEY, ND"	Inactive	None	---	---	---	Yes	---
05066500	"GOOSE RIVER AT HILLSBORO, ND"	Active	None	---	---	---	---	Yes
05067500	"MARSH RIVER NEAR SHELLY, MN"	Active	None	---	---	---	---	Yes
05069000	"SAND HILL RIVER AT CLIMAX, MN"	Active	Partial	---	---	---	---	Yes
05075000	"RED LAKE RIVER AT HIGH LANDING NR GOODRIDGE, MN"	Active	None	---	---	---	---	Yes
05077000	"CLEARWATER RIVER NEAR PINEWOOD, MN"	Inactive	None	---	---	---	Yes	---
05077700	"RUFFY BROOK NEAR GONVICK, MN"	Inactive	None	---	---	---	Yes	---
05079000	"RED LAKE RIVER AT CROOKSTON, MN"	Active	Partial	---	---	---	---	Yes
05082500	"RED RIVER OF THE NORTH AT GRAND FORKS, ND"	Active	Full	---	Yes	---	---	Yes
05083500	"RED RIVER OF THE NORTH AT OSLO, MN"	Active	Full	---	---	---	---	Yes
05085000	"FOREST RIVER AT MINTO, ND"	Active	Full	---	---	---	---	Yes
05085450	"SNAKE RIVER ABOVE WARREN, MN"	Active	None	---	---	---	---	Yes
05085900	"SNAKE RIVER ABOVE ALVARADO, MN"	Inactive	None	---	---	---	---	Yes
05087500	"MIDDLE RIVER AT ARGYLE, MN"	Active	None	---	---	---	---	Yes
05090000	"PARK RIVER AT GRAFTON, ND"	Active	None	---	---	---	Yes	Yes
05092000	"RED RIVER OF THE NORTH AT DRAYTON, ND"	Active	Full	---	---	---	---	Yes
05099400	"LITTLE SOUTH PEMBINA RIVER NR WALHALLA, ND"	Active	Full	---	---	---	Yes	Yes
05099600	"PEMBINA RIVER AT WALHALLA, ND"	Active	None	---	---	---	---	Yes
05100000	"PEMBINA RIVER AT NECHE, ND"	Active	None	---	Yes	---	---	Yes
05102490	"RED RIVER OF THE NORTH AT PEMBINA, ND"	Active	Full	---	Yes	Yes	---	Yes
05104500	"ROSEAU RIVER BELOW SOUTH FORK NEAR MALUNG, MN"	Active	Partial	---	---	---	---	Yes
05107500	"ROSEAU RIVER AT ROSS, MN"	Active	None	---	---	---	Yes	Yes
05112000	"ROSEAU RIVER BELOW STATE DITCH 51 NR CARIBOU, MN"	Active	Full	---	Yes	---	---	Yes
05113600	"LONG CREEK NR NOONAN, ND"	Active	None	---	Yes	---	---	---
05114000	"SOURIS RIVER NR SHERWOOD, ND"	Active	None	---	Yes	---	---	Yes
05116000	"SOURIS RIVER NR FOXHOLM, ND"	Active	None	---	---	---	---	Yes
05116500	"DES LACS RIVER AT FOXHOLM, ND"	Active	None	---	---	---	---	Yes
05117500	"SOURIS RIVER ABOVE MINOT, ND"	Active	None	---	---	---	---	Yes
05121500	"SOURIS RIVER NR TOWNER, ND"	Inactive	None	---	---	---	---	Yes
05122000	"SOURIS RIVER NR BANTRY, ND"	Active	None	---	---	---	---	Yes
05123400	"WILLOW CREEK NR WILLOW CITY, ND"	Active	None	---	---	---	Yes	---
05124000	"SOURIS RIVER NR WESTHOPE, ND"	Active	None	---	Yes	Yes	---	Yes
05124480	"KAWISHIWI RIVER NEAR ELY, MN"	Active	Full	Yes	---	---	Yes	---
05127000	"KAWISHIWI RIVER NEAR WINTON, MN"	Active	None	---	---	---	---	Yes
05127500	"BASSWOOD RIVER NEAR WINTON, MN"	Active	None	---	Yes	---	---	---
05129115	"VERMILION RIVER NR CRANE LAKE, MN"	Active	None	---	Yes	---	---	---
05129290	"GOLD PORTAGE OUTLET FROM KABETOGAMA LK NR RAY,MN"	Active	None	---	Yes	---	---	---
05131500	"LITTLE FORK RIVER AT LITTLEFORK, MN"	Active	None	---	Yes	Yes	---	---
05132000	"BIG FORK RIVER AT BIG FALLS, MN"	Active	None	---	Yes	---	---	---
05133500	"RAINY RIVER AT MANITOU RAPIDS, MN"	Active	None	---	Yes	Yes	---	---
05134200	"RAPID RIVER NEAR BAUDETTE, MN"	Active	Full	---	---	---	Yes	---
05211000	"MISSISSIPPI RIVER AT GRAND RAPIDS, MN"	Active	None	---	---	---	---	Yes
05212700	"PRAIRIE RIVER NEAR TACONITE, MN"	Active	Full	---	---	---	Yes	Yes
05213000	"PRAIRIE RIVER NEAR GRAND RAPIDS, MN"	Inactive	None	---	---	---	---	Yes
05227500	"MISSISSIPPI RIVER AT AITKIN, MN"	Active	Full	---	---	---	---	Yes
05242300	"MISSISSIPPI RIVER AT BRAINERD, MN"	Active	None	---	---	---	---	Yes
05245100	"LONG PRAIRIE RIVER AT LONG PRAIRIE, MN"	Active	None	---	---	---	Yes	Yes
05261000	"MISSISSIPPI RIVER NEAR FORT RIPLEY, MN"	Inactive	None	---	---	Yes	---	Yes
05267000	"MISSISSIPPI RIVER NEAR ROYALTON, MN"	Active	None	---	---	---	---	Yes
05270700	"MISSISSIPPI RIVER AT ST. CLOUD, MN"	Active	None	---	---	---	---	Yes
05275000	"ELK RIVER NEAR BIG LAKE, MN"	Active	None	---	---	---	Yes	---
05278500	"SOUTH FORK CROW RIVER AT COSMOS, MN"	Inactive	None	---	---	---	Yes	---
05280000	"CROW RIVER AT ROCKFORD, MN"	Active	Full	---	---	---	---	Yes
05287500	"MISSISSIPPI RIVER AT PARADISE PT PARK AT ANOKA, MN"	Inactive	None	---	---	---	---	Yes
05288500	"MISSISSIPPI RIVER AT HWY 610 IN BROOKLYN PARK, MN"	Active	None	---	---	---	---	Yes
05288650	"MISSISSIPPI RIVER BELOW I-694 AT FRIDLEY, MN"	Inactive	None	---	---	---	---	Yes
05288705	"SHINGLE CREEK AT QUEEN AVE IN MINNEAPOLIS, MN"	Active	Full	Yes	---	---	---	---
05290000	"LITTLE MINNESOTA RIVER NEAR PEEVER, SD"	Active	Full	---	---	---	---	Yes
05291000	"WHETSTONE RIVER NEAR BIG STONE CITY, SD"	Active	Full	---	---	---	Yes	---
05292000	"MINNESOTA RIVER AT ORTONVILLE, MN"	Active	None	---	Yes	---	---	---
05311000	"MINNESOTA RIVER AT MONTEVIDEO, MN"	Active	Partial	---	---	---	---	Yes
05311150	"MINNESOTA RIVER AT HWY 212 IN GRANITE FALLS, MN"	Active	Partial	---	---	---	---	Yes
05313500	"YELLOW MEDICINE RIVER NEAR GRANITE FALLS, MN"	Active	Full	---	---	---	---	Yes
05315000	"REDWOOD RIVER NEAR MARSHALL, MN"	Active	Partial	---	---	---	---	Yes
05316500	"REDWOOD RIVER NEAR REDWOOD FALLS, MN"	Active	None	---	---	---	---	Yes
05316580	"MINNESOTA RIVER AT MORTON, MN"	Active	Full	---	---	---	---	Yes
05316770	"MINNESOTA RIVER AT NEW ULM, MN"	Active	None	---	---	---	---	Yes
05317000	"COTTONWOOD RIVER NEAR NEW ULM, MN"	Active	Full	---	---	---	---	Yes
05317200	"LITTLE COTTONWOOD RIVER NEAR COURTLAND, MN"	Active	Partial	---	---	---	Yes	---
05319500	"WATONWAN RIVER NEAR GARDEN CITY, MN"	Active	None	---	---	---	---	Yes
05320270	"LITTLE COBB RIVER NEAR BEAUFORD, MN"	Inactive	None	Yes	---	---	---	---
05325000	"MINNESOTA RIVER AT MANKATO, MN"	Active	Partial	---	---	---	---	Yes
05330000	"MINNESOTA RIVER NEAR JORDAN, MN"	Active	Partial	---	---	Yes	---	Yes
05330713	"MINNESOTA RIVER BELOW ST. HWY. 101 IN SHAKOPEE, MN"	Inactive	None	---	---	---	---	Yes
05330900	"NINE MILE CREEK AT BLOOMINGTON, MN"	Inactive	None	---	---	---	Yes	---
05331000	"MISSISSIPPI RIVER AT ST. PAUL, MN"	Active	Full	---	---	Yes	---	Yes
05331580	"MISSISSIPPI RIVER BELOW L&amp;D #2 AT HASTINGS, MN"	Active	Full	Yes	---	---	---	Yes
05333500	"ST. CROIX RIVER NEAR DANBURY, WI"	Active	Full	---	Yes	---	---	---
05336200	"GLAISBY BROOK NEAR KETTLE RIVER, MN"	Inactive	None	---	---	---	Yes	---
05338500	"SNAKE RIVER NEAR PINE CITY, MN"	Active	Full	---	---	---	---	Yes
05340050	"SUNRISE RIVER NEAR LINDSTROM, MN"	Inactive	None	---	---	---	Yes	---
05340500	"ST. CROIX RIVER AT ST. CROIX FALLS, WI"	Active	Partial	---	---	Yes	---	---
05341550	"ST. CROIX RIVER AT STILLWATER, MN"	Active	None	---	---	---	---	Yes
05342000	"KINNICKINNIC RIVER NEAR RIVER FALLS, WI"	Active	Partial	---	---	---	Yes	---
05344500	"MISSISSIPPI RIVER AT PRESCOTT, WI"	Active	Full	---	Yes	---	---	---
05345000	"VERMILLION RIVER NEAR EMPIRE, MN"	Active	Partial	---	---	---	Yes	---
05355024	CANNON RIVER AT NORTHFIELD MN	Active	Full	---	---	---	---	Yes
05355250	"MISSISSIPPI RIVER AT RED WING, MN"	Active	Full	---	---	---	---	Yes
05362000	"JUMP RIVER AT SHELDON, WI"	Active	Full	---	---	---	---	Yes
05365500	"CHIPPEWA RIVER AT CHIPPEWA FALLS, WI"	Active	Partial	---	---	---	---	Yes
05368000	"HAY RIVER AT WHEELER, WI"	Active	Full	---	---	---	---	Yes
05369000	"RED CEDAR RIVER AT MENOMONIE, WI"	Active	Partial	---	---	---	Yes	---
05369500	"CHIPPEWA RIVER AT DURAND, WI"	Active	None	---	---	Yes	---	Yes
05372800	"S FORK ZUMBRO R ON BELT LINE AT ROCHESTER, MN"	Inactive	None	---	---	---	---	Yes
05372990	"CASCADE CREEK AT ROCHESTER, MN"	Inactive	None	---	---	---	---	Yes
05372995	"SOUTH FORK ZUMBRO RIVER AT ROCHESTER, MN"	Active	None	---	---	---	---	Yes
05373130	"NORTH BR MIDDLE FORK ZUMBRO R AT PINE ISLAND, MN"	Inactive	None	---	---	---	---	Yes
05374000	"ZUMBRO RIVER AT ZUMBRO FALLS, MN"	Active	None	---	---	---	---	Yes
05374500	"ZUMBRO RIVER AT THEILMAN, MN"	Inactive	None	---	---	---	---	Yes
05376000	"NORTH FORK WHITEWATER RIVER NEAR ELBA, MN"	Inactive	None	---	---	---	---	Yes
05376110	"MIDDLE FK WHITEWATER R AT ST PARK NR ST CHARLES,MN"	Inactive	None	---	---	---	---	Yes
05378500	"MISSISSIPPI RIVER AT WINONA, MN"	Active	Full	---	---	Yes	---	Yes
05379500	"TREMPEALEAU RIVER AT DODGE, WI"	Active	None	---	---	---	Yes	Yes
05381000	"BLACK RIVER AT NEILLSVILLE, WI"	Active	Full	---	---	---	Yes	Yes
05382000	"BLACK RIVER NEAR GALESVILLE, WI"	Active	None	---	---	Yes	---	Yes
05382325	"LA CROSSE RIVER AT SPARTA, WI"	Active	Full	---	---	---	---	Yes
05383075	"LA CROSSE RIVER NEAR LA CROSSE, WI"	Active	Partial	---	---	---	---	Yes
05383950	"ROOT RIVER NEAR PILOT MOUND, MN"	Active	Full	---	---	---	---	Yes
05384040	"SOUTH BRANCH ROOT R. AT CO. RD. 17 IN PRESTON, MN"	Inactive	None	---	---	---	---	Yes
05385000	"ROOT RIVER NEAR HOUSTON, MN"	Active	None	---	---	---	---	Yes
05387500	"Upper Iowa River at Decorah, IA"	Active	Full	---	---	---	---	Yes
05388250	"Upper Iowa River near Dorchester, IA"	Active	None	---	---	---	---	Yes
05389500	"Mississippi River at McGregor, IA"	Active	None	---	Yes	---	---	Yes
05394500	"PRAIRIE RIVER NEAR MERRILL, WI"	Active	Partial	---	---	---	Yes	---
05395000	"WISCONSIN RIVER AT MERRILL, WI"	Active	Partial	---	---	---	---	Yes
05396000	"BIG RIB RIVER AT RIB FALLS, WI"	Active	Full	---	---	---	---	Yes
05399500	"BIG EAU PLEINE RIVER AT STRATFORD, WI"	Active	Partial	---	---	---	Yes	---
05400760	"WISCONSIN RIVER AT WISCONSIN RAPIDS, WI"	Active	Partial	---	---	---	---	Yes
05402000	"YELLOW RIVER AT BABCOCK, WI"	Active	Partial	---	---	---	---	Yes
05403500	"LEMONWEIR RIVER AT NEW LISBON, WI"	Active	Full	---	---	---	---	Yes
05404000	"WISCONSIN RIVER NEAR WISCONSIN DELLS, WI"	Active	Partial	---	---	---	---	Yes
05404116	"WEST BRANCH BARABOO RIVER AT HILLSBORO, WI"	Inactive	Partial	---	---	---	---	Yes
05405000	"BARABOO RIVER NEAR BARABOO, WI"	Active	Full	---	---	---	---	Yes
05406470	"BREWERY CREEK AT CROSS PLAINS, WI"	Inactive	None	---	---	---	Yes	---
05407000	"WISCONSIN RIVER AT MUSCODA, WI"	Active	None	---	---	Yes	---	Yes
05407468	"KICKAPOO R @ ST HWY 131 AT ONTARIO, WI"	Active	Full	---	---	---	---	Yes
05408000	"KICKAPOO RIVER AT LA FARGE, WI"	Active	Partial	---	---	---	Yes	Yes
05409500	"KICKAPOO RIVER AT SOLDIERS GROVE, WI"	Inactive	None	---	---	---	---	Yes
05410490	"KICKAPOO RIVER AT STEUBEN, WI"	Active	None	---	---	---	---	Yes
05412020	"Turkey River above French Hollow Cr at Elkader, IA"	Active	Full	---	---	---	---	Yes
05412500	"Turkey River at Garber, IA"	Active	Full	---	---	---	---	Yes
05413500	"GRANT RIVER AT BURTON, WI"	Active	Partial	---	---	---	Yes	Yes
05414500	"Little Maquoketa River near Durango, IA"	Inactive	None	---	---	---	---	Yes
05415000	"GALENA RIVER AT BUNCOMBE, WI"	Inactive	None	---	---	---	---	Yes
05416000	"GALENA RIVER AT GALENA, IL"	Active	None	---	---	---	---	Yes
05416900	"Maquoketa River at Manchester, IA"	Active	Partial	---	---	---	---	Yes
05418500	"Maquoketa River near Maquoketa, IA"	Active	Full	---	---	---	Yes	Yes
05419000	"APPLE RIVER NEAR HANOVER, IL"	Active	None	---	---	---	---	Yes
05420500	"Mississippi River at Clinton, IA"	Active	None	Yes	Yes	Yes	---	Yes
05420680	"Wapsipinicon River near Tripoli, IA"	Active	Full	Yes	---	---	---	---
05421000	"Wapsipinicon River at Independence, IA"	Active	Full	---	---	---	---	Yes
05421740	"Wapsipinicon River near Anamosa, IA"	Active	Full	---	---	---	---	Yes
05422000	"Wapsipinicon River near De Witt, IA"	Active	Partial	---	---	---	---	Yes
05422600	"Duck Creek at DC Golf Course at Davenport, IA"	Active	Full	---	---	---	---	Yes
05430500	"ROCK RIVER AT AFTON, WI"	Active	None	---	---	---	---	Yes
05432500	"PECATONICA RIVER AT DARLINGTON, WI"	Active	Partial	---	---	---	Yes	Yes
05433000	"EAST BRANCH PECATONICA RIVER NR BLANCHARDVILLE, WI"	Active	Full	---	---	---	---	Yes
05434500	"PECATONICA RIVER AT MARTINTOWN, WI"	Active	Partial	---	Yes	---	---	Yes
05435500	"PECATONICA RIVER AT FREEPORT, IL"	Active	None	---	---	---	---	Yes
05436500	"SUGAR RIVER NEAR BRODHEAD, WI"	Active	None	---	Yes	---	Yes	Yes
05437000	"PECATONICA RIVER AT SHIRLAND, IL"	Inactive	None	---	---	---	---	Yes
05437500	"ROCK RIVER AT ROCKTON, IL"	Active	None	---	Yes	---	---	Yes
05437695	"KEITH CREEK AT EIGHTH STREET AT ROCKFORD, IL"	Inactive	None	---	---	---	---	Yes
05440000	"KISHWAUKEE RIVER NEAR PERRYVILLE, IL"	Active	None	---	---	---	---	Yes
05440700	"ROCK RIVER AT BYRON, IL"	Active	Full	---	---	---	---	Yes
05442300	"ROCK RIVER AT DIXON, IL"	Active	Full	---	---	---	---	Yes
05444000	"ELKHORN CREEK NEAR PENROSE, IL"	Active	Full	---	---	---	Yes	---
05444500	"ROCK RIVER AT LYNDON, IL"	Inactive	None	---	---	---	---	Yes
05446500	"ROCK RIVER NEAR JOSLIN, IL"	Active	None	---	---	Yes	---	Yes
05447500	"GREEN RIVER NEAR GENESEO, IL"	Active	None	---	---	---	---	Yes
05447800	"ROCK RIVER NEAR MOLINE, IL"	Inactive	None	---	---	---	---	Yes
05449500	"Iowa River near Rowan, IA"	Active	Partial	---	---	---	---	Yes
05451210	"South Fork Iowa River NE of New Providence, IA"	Active	Full	Yes	---	---	---	---
05451500	"Iowa River at Marshalltown, IA"	Active	Partial	---	---	---	---	Yes
05453100	"Iowa River at Marengo, IA"	Active	Partial	---	---	---	---	Yes
05453520	"Iowa River below Coralville Dam nr Coralville, IA"	Active	None	---	---	---	---	Yes
05455500	"English River at Kalona, IA"	Active	Partial	---	---	---	---	Yes
05455700	"Iowa River near Lone Tree, IA"	Active	None	---	---	---	---	Yes
05457000	"CEDAR RIVER NEAR AUSTIN, MN"	Active	Full	---	Yes	---	Yes	Yes
05457700	"Cedar River at Charles City, IA"	Active	Full	---	---	---	---	Yes
05458300	"Cedar River at Waverly, IA"	Active	Partial	---	---	---	---	Yes
05458500	"Cedar River at Janesville, IA"	Active	Full	---	---	---	---	Yes
05458900	"West Fork Cedar River at Finchford, IA"	Active	Partial	---	---	---	---	Yes
05459015	"Shell Rock River at Rockford, IA"	Inactive	None	---	---	---	---	Yes
05459500	"Winnebago River at Mason City, IA"	Active	Full	---	---	---	---	Yes
05460500	"Shell Rock River at Marble Rock, IA"	Inactive	None	---	---	---	---	Yes
05462000	"Shell Rock River at Shell Rock, IA"	Active	Partial	---	---	---	---	Yes
05463000	"Beaver Creek at New Hartford, IA"	Active	None	---	---	---	---	Yes
05463500	"Black Hawk Creek at Hudson, IA"	Active	Partial	---	---	---	---	Yes
05464000	"Cedar River at Waterloo, IA"	Active	Partial	---	---	---	---	Yes
05464315	"Cedar River at Vinton, IA"	Active	Full	---	---	---	---	Yes
05464500	"Cedar River at Cedar Rapids, IA"	Active	Full	---	---	---	---	Yes
05465000	"Cedar River near Conesville, IA"	Active	Partial	---	---	---	---	Yes
05465500	"Iowa River at Wapello, IA"	Active	Full	Yes	---	Yes	---	Yes
05466000	"EDWARDS RIVER NEAR ORION, IL"	Active	Full	---	---	---	Yes	---
05470000	"South Skunk River near Ames, IA"	Active	Partial	---	---	---	---	Yes
05470500	"Ioway Creek at Ames, IA"	Active	Partial	---	---	---	---	Yes
05471500	"South Skunk River near Oskaloosa, IA"	Active	None	---	---	---	---	Yes
05472500	"North Skunk River near Sigourney, IA"	Active	Partial	---	---	---	---	Yes
05474000	"Skunk River at Augusta, IA"	Active	Full	---	---	---	Yes	Yes
05474500	"Mississippi River at Keokuk, IA"	Active	None	---	Yes	Yes	---	---
05476000	"DES MOINES RIVER AT JACKSON, MN"	Active	None	---	Yes	---	---	Yes
05476590	"Des Moines River at Emmetsburg, IA"	Active	Partial	---	---	---	---	Yes
05476750	"Des Moines River at Humboldt, IA"	Active	Partial	---	---	---	---	Yes
05478265	"East Fork Des Moines River near Algona, IA"	Active	Partial	---	---	---	---	Yes
05479000	"East Fork Des Moines River at Dakota City, IA"	Active	None	---	---	---	---	Yes
05480500	"Des Moines River at Fort Dodge, IA"	Active	Partial	---	---	---	---	Yes
05481000	"Boone River near Webster City, IA"	Active	Partial	---	---	---	---	Yes
05481300	"Des Moines River near Stratford, IA"	Active	Partial	---	---	---	---	Yes
05481950	"Beaver Creek near Grimes, IA"	Active	Partial	---	---	---	---	Yes
05482000	"Des Moines River at 2nd Avenue at Des Moines, IA"	Active	Partial	---	---	---	---	Yes
05482500	"North Raccoon River near Jefferson, IA"	Active	Partial	---	---	---	---	Yes
05484000	"South Raccoon River at Redfield, IA"	Active	Partial	---	---	---	---	Yes
05484500	"Raccoon River at Van Meter, IA"	Active	Full	---	---	---	Yes	Yes
05484800	"Walnut Creek at Des Moines, IA"	Active	Partial	---	---	---	---	Yes
05484900	"Raccoon River at Fleur Drive at Des Moines, IA"	Active	None	---	---	---	---	Yes
05485500	"Des Moines River blw Raccoon Riv at Des Moines, IA"	Active	Partial	---	---	---	---	Yes
05485640	"Fourmile Creek at Des Moines, IA"	Active	Partial	---	---	---	---	Yes
05486000	"North River near Norwalk, IA"	Active	Partial	---	---	---	---	Yes
05486490	"Middle River near Indianola, IA"	Active	Partial	---	---	---	---	Yes
05487470	"South River near Ackworth, IA"	Active	Partial	---	---	---	---	Yes
05487500	"Des Moines River near Runnells, IA"	Inactive	None	---	Yes	---	---	---
05488110	"Des Moines River near Pella, IA"	Active	None	---	---	---	---	Yes
05488500	"Des Moines River near Tracy, IA"	Active	None	---	---	---	---	Yes
05489000	"Cedar Creek near Bussey, IA"	Active	Partial	---	---	---	---	Yes
05489500	"Des Moines River at Ottumwa, IA"	Active	Partial	---	---	---	---	Yes
05490500	"Des Moines River at Keosauqua, IA"	Active	None	---	Yes	---	---	Yes
05490600	"Des Moines River at St. Francisville, MO"	Active	Full	---	---	Yes	---	Yes
05491000	"Sugar Creek near Keokuk, IA"	Inactive	None	---	---	---	Yes	---
05495000	"Fox River at Wayland, MO"	Active	Full	---	---	---	---	Yes
05495500	"BEAR CREEK NEAR MARCELLINE, IL"	Active	Full	---	---	---	Yes	---
05497150	"North Fabius River near Ewing, MO"	Active	None	---	---	---	---	Yes
05498150	"Middle Fabius River near Ewing, MO"	Active	None	---	---	---	---	Yes
05500000	"South Fabius River near Taylor, MO"	Active	None	---	---	---	---	Yes
05501000	"North River at Palmyra, MO"	Active	None	---	---	---	Yes	Yes
05501600	"Mississippi River at Hannibal, MO"	Active	None	---	---	---	---	Yes
05508000	"Salt River near New London, MO"	Active	None	---	---	---	---	Yes
05512500	"BAY CREEK AT PITTSFIELD, IL"	Active	Full	---	---	---	Yes	---
05514500	"Cuivre River near Troy, MO"	Active	Partial	---	---	---	---	Yes
05514705	"Cuivre River at Old Monroe, MO"	Active	Full	---	---	---	---	Yes
05515500	"KANKAKEE RIVER AT DAVIS, IN"	Active	None	---	---	---	---	Yes
05516500	"YELLOW RIVER AT PLYMOUTH, IN"	Active	None	---	---	---	Yes	---
05517000	"YELLOW RIVER AT KNOX, IN"	Active	None	---	---	---	---	Yes
05517500	"KANKAKEE RIVER AT DUNNS BRIDGE, IN"	Active	Partial	---	---	---	---	Yes
05518000	"KANKAKEE RIVER AT SHELBY, IN"	Active	Partial	---	---	---	Yes	Yes
05520500	"KANKAKEE RIVER AT MOMENCE, IL"	Active	Full	---	Yes	---	---	Yes
05525000	"IROQUOIS RIVER AT IROQUOIS, IL"	Active	Full	---	Yes	---	---	Yes
05525540	"IROQUOIS RIVER NEAR WATSEKA, IL"	Inactive	None	---	---	---	---	Yes
05526000	"IROQUOIS RIVER NEAR CHEBANSE, IL"	Active	Full	---	---	---	---	Yes
05526100	"KANKAKEE RIVER AT WATER WORKS AT KANKAKEE, IL"	Inactive	None	---	---	---	---	Yes
05527500	"KANKAKEE RIVER NEAR WILMINGTON, IL"	Active	None	---	---	---	---	Yes
05527800	"DES PLAINES RIVER AT RUSSELL, IL"	Active	Full	---	---	---	Yes	Yes
05528000	"DES PLAINES RIVER NEAR GURNEE, IL"	Active	None	---	---	---	---	Yes
05530000	"WELLER CREEK AT DES PLAINES, IL"	Active	None	---	---	---	---	Yes
05531500	"SALT CREEK AT WESTERN SPRINGS, IL"	Active	None	Yes	---	---	---	Yes
05532500	"DES PLAINES RIVER AT RIVERSIDE, IL"	Active	Full	Yes	---	---	---	---
05534500	"NORTH BRANCH CHICAGO RIVER AT DEERFIELD, IL"	Active	None	---	---	---	---	Yes
05535000	"SKOKIE RIVER AT LAKE FOREST, IL"	Active	None	---	---	---	---	Yes
05535500	WF OF NB CHICAGO RIVER AT NORTHBROOK IL	Active	Full	---	---	---	---	Yes
05536085	"NB CHICAGO RIVER AT N PULASKI ROAD AT CHICAGO, IL"	Active	Full	---	---	---	---	Yes
05536190	"HART DITCH AT MUNSTER, IN"	Active	Partial	---	---	---	---	Yes
05536210	"THORN CREEK NEAR CHICAGO HEIGHTS, IL"	Inactive	None	---	---	---	---	Yes
05536215	"THORN CREEK AT GLENWOOD, IL"	Active	Full	---	---	---	---	Yes
05536235	"DEER CREEK NEAR CHICAGO HEIGHTS, IL"	Active	None	---	---	---	---	Yes
05536255	"BUTTERFIELD CREEK AT FLOSSMOOR, IL"	Active	Full	---	---	---	---	Yes
05536265	"LANSING DITCH NEAR LANSING, IL"	Active	None	---	---	---	---	Yes
05536275	"THORN CREEK AT THORNTON, IL"	Active	None	---	---	---	---	Yes
05536290	"LITTLE CALUMET RIVER AT SOUTH HOLLAND, IL"	Active	None	---	---	---	---	Yes
05536340	"MIDLOTHIAN CREEK AT OAK FOREST, IL"	Active	None	---	---	---	---	Yes
05539000	"HICKORY CREEK AT JOLIET, IL"	Active	Full	---	---	---	---	Yes
05540095	"WEST BRANCH DU PAGE RIVER NEAR WARRENVILLE, IL"	Active	Full	---	---	---	---	Yes
05540500	"DU PAGE RIVER AT SHOREWOOD, IL"	Active	Full	---	---	---	---	Yes
05542500	"ILLINOIS RIVER AT MORRIS, IL"	Active	Full	---	---	---	---	Yes
05543500	"ILLINOIS RIVER AT MARSEILLES, IL"	Active	Full	---	---	Yes	---	---
05545750	"FOX RIVER NEAR NEW MUNSTER, WI"	Active	Partial	---	Yes	---	---	Yes
05546700	"FOX RIVER NEAR CHANNEL LAKE, IL"	Inactive	None	---	---	---	---	Yes
05550000	"FOX RIVER AT ALGONQUIN, IL"	Active	Full	---	---	---	---	Yes
05551580	"FOX RIVER AT YORKVILLE, IL"	Active	Full	---	---	---	---	Yes
05551700	"BLACKBERRY CREEK NEAR YORKVILLE, IL"	Active	None	---	---	---	---	Yes
05552500	"FOX RIVER AT DAYTON, IL"	Active	None	---	---	---	---	Yes
05554500	"VERMILION RIVER AT PONTIAC, IL"	Active	None	---	---	---	---	Yes
05555300	"VERMILION RIVER NEAR LEONORE, IL"	Active	None	---	---	---	---	Yes
05556000	"ILLINOIS RIVER NEAR LA SALLE, IL"	Inactive	None	---	---	---	---	Yes
05556500	"BIG BUREAU CREEK AT PRINCETON, IL"	Active	None	---	---	---	---	Yes
05558300	"ILLINOIS RIVER AT HENRY, IL"	Active	None	---	---	---	---	Yes
05560000	"ILLINOIS RIVER AT PEORIA, IL"	Inactive	None	---	---	---	---	Yes
05568800	"INDIAN CREEK NEAR WYOMING, IL"	Active	None	---	---	---	Yes	---
05568830	"SPOON RIVER AT ELMORE, IL"	Active	None	---	---	---	---	Yes
05569500	"SPOON RIVER AT LONDON MILLS, IL"	Active	None	---	---	---	---	Yes
05570000	"SPOON RIVER AT SEVILLE, IL"	Active	None	---	---	---	---	Yes
05570500	"ILLINOIS RIVER AT HAVANA, IL"	Inactive	None	---	---	---	---	Yes
05572000	"SANGAMON RIVER AT MONTICELLO, IL"	Active	Full	Yes	---	---	---	Yes
05573540	"SANGAMON RIVER AT ROUTE 48 AT DECATUR, IL"	Active	None	---	---	---	---	Yes
05576500	"SANGAMON RIVER AT RIVERTON, IL"	Active	None	---	---	---	---	Yes
05578000	"SANGAMON RIVER AT PETERSBURG, IL"	Active	Full	---	---	---	---	Yes
05578500	"SALT CREEK NEAR ROWELL, IL"	Active	Full	---	---	---	---	Yes
05579500	"LAKE FORK NEAR CORNLAND, IL"	Active	None	---	---	---	---	Yes
05580000	"KICKAPOO CREEK AT WAYNESVILLE, IL"	Active	None	---	---	---	---	Yes
05580950	"SUGAR CREEK NEAR BLOOMINGTON, IL"	Active	Full	---	---	---	---	Yes
05581500	"SUGAR CREEK NEAR HARTSBURG, IL"	Inactive	None	---	---	---	---	Yes
05582000	"SALT CREEK NEAR GREENVIEW, IL"	Active	None	---	---	---	---	Yes
05583000	"SANGAMON RIVER NEAR OAKFORD, IL"	Active	None	---	---	---	---	Yes
05584000	"ILLINOIS RIVER AT BEARDSTOWN, IL"	Inactive	None	---	---	---	---	Yes
05584500	"LA MOINE RIVER AT COLMAR, IL"	Active	None	---	---	---	---	Yes
05585000	"LA MOINE RIVER AT RIPLEY, IL"	Active	None	---	---	---	---	Yes
05586100	"ILLINOIS RIVER AT VALLEY CITY, IL"	Active	Partial	Yes	---	---	---	---
05587060	"ILLINOIS RIVER AT HARDIN, IL"	Active	None	---	---	Yes	---	Yes
05587450	"Mississippi River at Grafton, IL"	Active	None	---	Yes	Yes	---	Yes
05587455	"MISSISSIPPI RIVER BELOW GRAFTON, IL"	Active	None	Yes	---	---	---	---
05587500	"Mississippi River at Alton, IL"	Inactive	None	---	---	---	---	Yes
05588000	"INDIAN CREEK AT WANDA, IL"	Active	None	---	---	---	Yes	---
